"...1","id","title","date","group_name","people","total_weight","area_cleaned","cleanup_duration","location","lat","long","total_items","plastic","glass","metal","cloth","mixed","paper_wood","dumping","eating.drinking","fishing","personal.hygiene","recreation","smoking","various","construction","clothing_fabric","miscellaneous","paper_wood_products","tires","six_pack_holders","bags_plastic","bags_paper","beverage_containers","bottle_caps","bottles","cans","container_closures","foodware","straws_stirrers","takeout_food_containers_plastic","takeout_food_containers_paper","utensils","wrappers","buoys_pots_traps_floats","fishing_gear","fishing_lines","fishing_net_and_rope","diapers","personal_care_products","ppe","syringes","tampons_applicators","balloons","fireworks","shotgun_wads_shells","packaging_and_other_smoking","cigar_tips","cigarette_butts","e_cigarettes","lighter","glass_fragments","metal_fragments","packaging","plastic_fragments","source","adults","children","distance_cleaned","number_of_bags","site_length","total_weight_kg"
1,2666,"Cleanup on 8/18/18 by San Luis Obispo Chapter at Pismo Beach Pier - San Luis Obispo - CA",2018-08-18,"San Luis Obispo",8,1,NA,NA,"Pismo Beach Pier",35.138888888889,-120.64333333333,317,317,0,0,0,0,0,0,0,0,0,0,317,0,0,0,0,0,0,0,0,0,0,0,0,0,0,0,0,0,0,0,0,0,0,0,0,0,0,0,0,0,0,0,0,0,0,317,0,0,0,0,0,0,"surfrider",NA,NA,NA,NA,NA,NA
2,2129,"Cleanup on 9/15/18 by San Luis Obispo Chapter at Sandspit Beach",2018-09-15,"San Luis Obispo",11,72,NA,NA,"Sandspit Beach",35.308888888889,-120.87166666667,177,158,12,7,0,0,0,0,55,22,0,5,45,50,0,0,0,0,0,0,12,0,0,11,19,7,0,0,6,0,0,0,0,2,0,11,9,0,0,0,0,0,5,0,0,0,0,45,0,0,0,0,0,50,"surfrider",NA,NA,NA,NA,NA,NA
3,2637,"Cleanup on 10/6/18 by San Luis Obispo Chapter at Pirate's Cove - San Luis Obispo - CA",2018-10-06,"San Luis Obispo",30,40,NA,NA,"Pirate's Cove",35.176111111111,-120.71583333333,1621,1467,115,39,0,0,0,0,275,8,0,0,1313,25,0,0,0,0,0,0,36,0,0,20,159,39,0,0,21,0,0,0,0,0,0,8,0,0,0,0,0,0,0,0,0,0,0,1313,0,0,0,0,0,25,"surfrider",NA,NA,NA,NA,NA,NA
4,5156,"Cleanup on 10/31/2018 at Morro Strand State Beach by Unaffiliated with a Surfrider Chapter/Club",2018-10-31,"Unaffiliated with a Surfrider Chapter/Club",1,1,NA,1,"Morro Strand State Beach",35.403333333333,-120.86888888889,49,34,5,2,0,4,4,0,13,0,0,0,16,20,0,0,4,4,0,0,0,0,0,4,0,0,0,0,1,0,0,0,8,0,0,0,0,0,0,0,0,0,0,0,0,0,0,16,0,0,5,1,0,6,"surfrider",NA,NA,NA,NA,NA,NA
5,2638,"Cleanup on 11/3/18 by San Luis Obispo Chapter at Pirate's Cove - San Luis Obispo - CA",2018-11-03,"San Luis Obispo",30,65,NA,NA,"Pirate's Cove",35.176111111111,-120.71583333333,1489,1333,114,42,0,0,0,0,329,0,0,0,1160,0,0,0,0,0,0,0,38,0,0,52,167,42,0,0,30,0,0,0,0,0,0,0,0,0,0,0,0,0,0,0,0,0,0,1160,0,0,0,0,0,0,"surfrider",NA,NA,NA,NA,NA,NA
6,2639,"Cleanup on 12/8/18 by San Luis Obispo Chapter at Pirate's Cove - San Luis Obispo - CA",2018-12-08,"San Luis Obispo",45,103,NA,NA,"Pirate's Cove",35.176111111111,-120.71583333333,413,222,116,75,0,0,0,0,338,0,0,0,0,75,0,0,0,0,0,0,29,0,0,40,165,75,0,0,29,0,0,0,0,0,0,0,0,0,0,0,0,0,0,0,0,0,0,0,0,0,0,0,0,75,"surfrider",NA,NA,NA,NA,NA,NA
7,3170,"Cleanup on 09/21/2019 at West Grand Ave by San Luis Obispo",2019-09-21,"San Luis Obispo",68,74.3,2,2,"West Grand Ave",35.124166666667,-120.63472222222,2125,1808,130,118,0,22,47,2,890,10,7,23,423,768,0,0,1,2,2,2,101,34,0,233,67,24,17,20,77,54,0,17,244,0,0,0,10,4,1,0,0,2,7,16,0,2,4,415,0,4,112,12,0,641,"surfrider",NA,NA,NA,NA,NA,NA
8,3150,"Cleanup on 09/21/2019 at Morro Creek by California Polytechnic State University",2019-09-21,"California Polytechnic State University",30,39,0.5,3,"Morro Creek",35.376327,-120.864604,1029,842,87,39,0,11,50,3,357,6,6,3,283,369,0,0,4,36,3,0,18,4,0,83,25,4,14,13,18,25,0,0,157,0,0,1,5,3,0,0,0,3,2,1,0,2,0,282,0,1,73,0,0,252,"surfrider",NA,NA,NA,NA,NA,NA
9,3723,"Cleanup on 10/06/2019 at Pirates Cove by California Polytechnic State University",2019-10-06,"California Polytechnic State University",33,39,NA,2,"Pirates Cove",35.175,-120.7152,975,346,345,181,0,4,99,0,309,1,4,3,91,567,0,0,0,59,0,0,20,0,0,106,32,28,9,45,5,4,0,1,59,0,0,1,0,0,3,0,0,1,0,3,0,0,0,91,0,0,325,72,0,111,"surfrider",NA,NA,NA,NA,NA,NA
10,3899,"Cleanup on 10/18/2019 at Grover Beach by California Polytechnic State University",2019-10-18,"California Polytechnic State University",46,40,NA,2,"Grover Beach",35.121611,-120.621306,1091,557,61,60,0,207,206,40,406,15,2,31,105,492,0,0,206,137,0,0,3,0,0,115,6,3,0,69,12,0,0,13,185,0,0,1,14,0,0,0,0,2,31,0,0,0,0,105,0,0,60,19,0,110,"surfrider",NA,NA,NA,NA,NA,NA
11,3880,"Cleanup on 10/27/2019 at West Grand Ave by San Luis Obispo",2019-10-27,"San Luis Obispo",15,10.92,1,1,"West Grand Ave",35.124166666667,-120.63472222222,175,130,10,14,0,6,15,0,67,0,0,6,62,40,0,0,0,0,0,0,0,3,0,4,6,8,0,12,0,0,0,0,34,0,0,0,0,0,0,0,0,0,0,6,0,0,0,62,0,0,6,2,0,32,"surfrider",NA,NA,NA,NA,NA,NA
12,3975,"Cleanup on 10/27/2019 at Pirates Cove by California Polytechnic State University",2019-10-27,"California Polytechnic State University",30,87,NA,2,"Pirates Cove",35.175,-120.7152,1208,636,175,140,0,107,150,20,485,2,6,0,354,339,0,0,104,90,0,0,21,7,0,81,82,68,19,64,19,2,0,13,112,0,0,1,1,0,3,0,0,3,0,0,0,2,0,354,0,0,124,14,3,21,"surfrider",NA,NA,NA,NA,NA,NA
13,3982,"Cleanup on 11/09/2019 at Sandspit by California Polytechnic State University",2019-11-09,"California Polytechnic State University",46,95,NA,2,"Sandspit",35.308654,-120.871426,803,211,322,178,0,41,51,3,56,2,1,0,3,738,0,0,40,50,0,0,12,0,0,10,4,2,5,4,2,1,0,2,15,0,0,1,1,0,0,0,0,1,0,0,0,0,0,3,0,0,322,174,1,153,"surfrider",NA,NA,NA,NA,NA,NA
14,4227,"Cleanup on 01/12/2020 at Pirates Cove by California Polytechnic State University",2020-01-12,"California Polytechnic State University",84,107,NA,2,"Pirates Cove",35.175,-120.7152,1625,770,238,288,0,96,233,3,858,2,41,0,198,510,0,0,91,151,0,0,23,4,0,159,184,131,36,131,35,17,0,7,135,0,0,1,1,0,33,0,3,5,0,0,0,20,0,189,0,2,93,24,3,147,"surfrider",NA,NA,NA,NA,NA,NA
15,4281,"Cleanup on 01/26/2020 at Sandspit by California Polytechnic State University",2020-01-26,"California Polytechnic State University",45,95,NA,2,"Sandspit",35.308654,-120.871426,1060,437,202,197,0,195,29,13,70,4,0,0,1,972,0,0,195,29,0,0,33,0,0,14,1,1,0,0,3,0,0,0,18,0,0,0,4,0,0,0,0,0,0,0,0,0,0,1,0,0,202,191,0,368,"surfrider",NA,NA,NA,NA,NA,NA
16,4304,"Cleanup on 02/09/2020 at Pirates Cove by California Polytechnic State University",2020-02-09,"California Polytechnic State University",20,110,NA,2,"Pirates Cove",35.175,-120.7152,1058,461,210,131,0,102,154,4,432,12,21,0,128,457,0,0,101,63,0,0,32,1,0,43,84,53,14,93,11,15,5,0,85,0,0,6,6,0,19,0,1,1,0,0,0,7,0,125,0,0,147,43,0,103,"surfrider",NA,NA,NA,NA,NA,NA
17,4360,"Cleanup on 02/23/2020 at Pismo Beach by California Polytechnic State University",2020-02-23,"California Polytechnic State University",22,40,NA,2,"Pismo Beach",35.138267,-120.64188,681,392,5,25,0,123,136,0,239,8,0,0,98,333,0,0,122,103,0,0,4,1,1,24,16,12,6,33,10,0,0,5,127,0,0,1,7,0,0,0,0,0,0,0,0,3,0,98,0,0,2,2,3,101,"surfrider",NA,NA,NA,NA,NA,NA
18,4359,"Cleanup on 03/01/2020 at Pirates Cove by California Polytechnic State University",2020-03-01,"California Polytechnic State University",77,65,NA,2,"Pirates Cove",35.175,-120.7152,1798,863,259,231,0,201,244,6,551,11,9,0,481,732,0,0,198,125,0,0,6,2,0,160,51,48,10,112,12,4,1,5,141,0,1,9,1,0,7,0,0,2,0,0,0,15,0,472,0,2,229,51,4,130,"surfrider",NA,NA,NA,NA,NA,NA
19,4355,"Cleanup on 03/01/2020 at Morro Strand State Beach by San Luis Obispo",2020-03-01,"San Luis Obispo",15,21,NA,2,"Morro Strand State Beach",35.403333333333,-120.86888888889,704,483,6,6,0,3,206,0,387,5,0,3,154,142,0,0,0,0,0,1,18,2,0,2,53,4,26,226,17,1,0,6,41,0,0,0,5,0,0,0,0,0,0,3,0,13,0,154,0,0,0,0,0,132,"surfrider",NA,NA,NA,NA,NA,NA
20,4616,"Cleanup on 08/08/2020 at Avila Beach by San Luis Obispo",2020-08-08,"San Luis Obispo",9,8,NA,1,"Avila Beach",35.179166666667,-120.73666666667,95,63,0,11,0,16,5,0,43,0,4,2,15,31,0,0,14,2,0,0,7,0,0,4,6,9,3,5,1,1,0,3,4,0,0,0,0,0,2,2,0,0,2,0,0,0,0,15,0,0,0,0,0,15,"surfrider",NA,NA,NA,NA,NA,NA
21,4689,"Cleanup on 09/05/2020 at Avila Beach by San Luis Obispo",2020-09-05,"San Luis Obispo",3,500,0.5,6,"Avila Beach",35.179166666667,-120.73666666667,1209,749,175,78,7,111,89,6,770,6,53,0,50,324,0,0,42,56,0,0,40,0,35,102,172,50,60,85,65,10,8,35,120,0,6,0,0,2,11,37,0,3,0,0,0,0,0,50,0,0,100,1,6,113,"surfrider",NA,NA,NA,NA,NA,NA
22,4808,"Cleanup on 09/22/2020 at South Palisades Park by San Luis Obispo",2020-09-22,"San Luis Obispo",1,5,0.4,1,"South Palisades Park",35.16851116,-120.6961441,76,22,15,3,0,3,33,0,25,0,1,0,7,43,0,0,3,31,0,0,0,0,0,6,12,1,1,3,0,0,0,0,2,0,0,0,0,0,1,0,0,0,0,0,0,0,1,6,0,0,5,0,0,4,"surfrider",NA,NA,NA,NA,NA,NA
23,4826,"Cleanup on 09/23/2020 at Avila Beach by San Luis Obispo",2020-09-23,"San Luis Obispo",1,1.5,0.75,1,"Avila Beach",35.179166666667,-120.73666666667,60,48,3,2,0,4,3,0,19,0,0,1,4,36,0,0,3,0,0,0,0,0,1,2,3,0,2,5,2,0,0,0,5,0,0,0,0,0,0,0,0,0,1,0,0,0,0,4,0,0,0,2,0,30,"surfrider",NA,NA,NA,NA,NA,NA
24,5149,"Cleanup on 10/17/2020 at Pismo Beach Pier by San Luis Obispo",2020-10-17,"San Luis Obispo",1,0.47,1,1,"Pismo Beach Pier",35.138888888889,-120.64333333333,39,36,0,0,0,0,3,0,11,0,3,0,15,9,0,0,0,0,0,0,3,0,0,0,1,0,0,3,1,1,0,2,2,0,0,0,0,0,2,1,0,0,0,0,0,1,0,15,0,0,0,0,0,7,"surfrider",NA,NA,NA,NA,NA,NA
25,5145,"Cleanup on 10/17/2020 at Pismo Beach Pier by San Luis Obispo",2020-10-17,"San Luis Obispo",10,1,NA,2,"Pismo Beach Pier",35.138888888889,-120.64333333333,50,45,0,3,0,1,1,0,17,0,3,0,15,14,0,0,0,1,0,0,0,0,0,5,0,1,2,0,1,0,0,1,7,0,0,0,0,0,2,1,0,0,0,0,0,1,0,15,0,0,0,0,0,13,"surfrider",NA,NA,NA,NA,NA,NA
26,5160,"Cleanup on 10/18/2020 at Pirate's Cove by California Polytechnic State University",2020-10-18,"California Polytechnic State University",1,4,NA,1,"Pirate's Cove",35.176111111111,-120.71583333333,177,96,22,35,0,14,10,0,68,0,3,0,36,70,0,0,14,3,0,0,2,0,0,22,11,17,1,11,0,0,0,0,6,0,0,0,0,0,3,0,0,0,0,0,0,0,0,36,0,0,13,0,0,38,"surfrider",NA,NA,NA,NA,NA,NA
27,5151,"Cleanup on 10/24/2020 at Morro Rock by San Luis Obispo",2020-10-24,"San Luis Obispo",1,1,1,0.5,"Morro Rock",35.371666666667,-120.86444444444,27,19,2,0,0,2,4,0,13,0,2,0,12,0,0,0,0,0,0,0,0,0,0,0,3,0,4,4,0,2,0,0,0,0,0,0,0,0,0,2,0,0,0,0,0,0,0,12,0,0,0,0,0,0,"surfrider",NA,NA,NA,NA,NA,NA
28,5158,"Cleanup on 10/29/2020 at Pirate's Cove by Unaffiliated with a Surfrider Chapter/Club",2020-10-29,"Unaffiliated with a Surfrider Chapter/Club",1,4,NA,1,"Pirate's Cove",35.176111111111,-120.71583333333,73,48,1,14,0,3,7,0,40,0,3,0,18,12,0,0,3,1,0,0,0,0,0,12,2,3,2,11,2,0,0,0,8,0,0,0,0,0,1,2,0,0,0,0,0,0,0,18,0,0,0,0,0,8,"surfrider",NA,NA,NA,NA,NA,NA
29,5154,"Cleanup on 10/29/2020 at Pirate's Cove by Unaffiliated with a Surfrider Chapter/Club",2020-10-29,"Unaffiliated with a Surfrider Chapter/Club",1,5,NA,1,"Pirate's Cove",35.176111111111,-120.71583333333,44,29,2,6,0,4,3,0,22,0,4,0,10,7,0,0,1,3,0,0,0,0,0,2,0,3,0,6,0,2,0,0,9,0,0,0,0,0,1,3,0,0,0,0,0,1,0,10,0,0,2,1,0,0,"surfrider",NA,NA,NA,NA,NA,NA
30,5159,"Cleanup on 10/30/2020 at Shell Beach by California Polytechnic State University",2020-10-30,"California Polytechnic State University",1,3,2,1.5,"Shell Beach",35.168223,-120.695438,45,26,4,11,1,1,2,0,29,3,3,0,3,6,0,0,0,0,0,0,2,1,0,4,4,8,1,2,1,0,0,0,6,0,0,1,2,0,1,2,0,0,0,0,0,1,0,3,0,0,2,0,0,4,"surfrider",NA,NA,NA,NA,NA,NA
31,5161,"Cleanup on 10/31/2020 at Pirate's Cove by California Polytechnic State University",2020-10-31,"California Polytechnic State University",1,5,NA,1,"Pirate's Cove",35.176111111111,-120.71583333333,73,47,13,10,0,2,1,0,28,1,6,0,10,28,0,0,1,0,0,0,3,0,0,10,7,4,0,1,1,0,0,0,5,0,0,0,1,0,4,2,0,0,0,0,0,0,0,10,0,0,8,0,0,16,"surfrider",NA,NA,NA,NA,NA,NA
32,5155,"Cleanup on 10/31/2020 at Pirate's Cove by Unaffiliated with a Surfrider Chapter/Club",2020-10-31,"Unaffiliated with a Surfrider Chapter/Club",1,5,NA,1,"Pirate's Cove",35.176111111111,-120.71583333333,69,39,13,9,0,2,6,2,27,1,3,0,8,28,0,0,0,5,0,0,3,1,0,9,5,2,1,0,2,1,0,0,7,0,1,0,0,0,1,2,0,0,0,0,0,0,0,8,0,0,10,0,0,11,"surfrider",NA,NA,NA,NA,NA,NA
33,5157,"Cleanup on 10/31/2020 at Morro Strand State Beach by Unaffiliated with a Surfrider Chapter/Club",2020-10-31,"Unaffiliated with a Surfrider Chapter/Club",1,5,NA,1,"Morro Strand State Beach",35.403333333333,-120.86888888889,74,52,3,3,0,3,13,0,20,0,2,0,26,26,0,0,3,10,0,0,4,0,0,6,1,0,0,2,0,0,1,0,6,0,0,0,0,0,0,2,0,0,0,0,0,0,0,26,0,0,3,0,0,10,"surfrider",NA,NA,NA,NA,NA,NA
34,5150,"Cleanup on 10/31/2020 at Morro Strand State Beach by San Luis Obispo",2020-10-31,"San Luis Obispo",NA,NA,NA,NA,"Morro Strand State Beach",35.403333333333,-120.86888888889,10,7,0,0,0,1,2,0,5,0,1,0,2,2,0,0,0,0,0,0,2,0,0,0,1,0,0,2,0,0,0,0,0,0,0,0,0,0,0,1,0,0,0,0,0,0,0,2,0,0,0,0,0,2,"surfrider",NA,NA,NA,NA,NA,NA
35,5153,"Cleanup on 11/04/2020 at Pirates Cove by San Luis Obispo",2020-11-04,"San Luis Obispo",1,5,NA,1.5,"Pirates Cove",35.175,-120.7152,118,117,0,0,0,1,0,0,60,0,7,0,40,11,0,0,0,0,0,0,3,0,0,0,15,0,10,10,2,0,0,0,20,0,0,0,0,0,6,1,0,0,0,0,0,0,0,40,0,0,0,0,0,11,"surfrider",NA,NA,NA,NA,NA,NA
36,5285,"Cleanup on 11/21/2020 at Pismo Beach Pier by San Luis Obispo",2020-11-21,"San Luis Obispo",1,1.14,0.5,1,"Pismo Beach Pier",35.138888888889,-120.64333333333,108,80,0,2,0,3,23,0,42,0,0,0,13,53,0,0,3,16,0,0,1,0,0,8,3,1,3,6,8,0,0,2,11,0,0,0,0,0,0,0,0,0,0,0,0,0,0,13,0,0,0,0,1,32,"surfrider",NA,NA,NA,NA,NA,NA
37,5356,"Cleanup on 12/06/2020 at Avila Beach by San Luis Obispo",2020-12-06,"San Luis Obispo",3,5,1,1.35,"Avila Beach",35.179166666667,-120.73666666667,243,191,25,2,0,0,25,0,82,0,1,1,22,136,0,0,1,18,0,0,0,0,0,9,0,2,3,6,7,0,1,3,53,0,0,0,0,0,1,0,0,0,1,0,0,1,0,22,0,0,25,0,1,89,"surfrider",NA,NA,NA,NA,NA,NA
38,5359,"Cleanup on 12/08/2020 at Avila Beach by San Luis Obispo",2020-12-08,"San Luis Obispo",1,3,1,1,"Avila Beach",35.179166666667,-120.73666666667,134,88,3,2,0,30,11,0,69,0,1,0,5,59,0,0,30,5,0,0,0,0,0,51,3,1,0,1,13,0,0,1,0,0,0,0,0,0,1,0,0,0,0,0,0,0,0,5,0,0,2,0,0,21,"surfrider",NA,NA,NA,NA,NA,NA
39,5373,"Cleanup on 12/09/2020 at Avila Beach by San Luis Obispo",2020-12-09,"San Luis Obispo",1,1,1,1,"Avila Beach",35.179166666667,-120.73666666667,77,72,0,0,0,0,5,0,43,0,0,0,10,24,0,0,0,5,0,0,1,0,0,30,2,0,0,1,7,0,0,0,2,0,0,0,0,0,0,0,0,0,0,0,0,0,0,10,0,0,0,0,0,19,"surfrider",NA,NA,NA,NA,NA,NA
40,5618,"Cleanup on 02/06/2021 at Pismo Beach by Unaffiliated with a Surfrider Chapter/Club",2021-02-06,"Unaffiliated with a Surfrider Chapter/Club",2,15,NA,2,"Pismo Beach",35.138267,-120.64188,96,78,0,0,0,15,3,3,15,0,0,0,4,74,0,0,15,3,0,0,0,0,0,5,0,0,0,0,6,4,0,0,5,0,0,0,0,0,0,0,0,0,0,0,0,0,0,2,0,2,0,0,2,52,"surfrider",NA,NA,NA,NA,NA,NA
41,5634,"Cleanup on 02/12/2021 at Pismo Beach by Unaffiliated with a Surfrider Chapter/Club",2021-02-12,"Unaffiliated with a Surfrider Chapter/Club",1,4,NA,2,"Pismo Beach",35.138267,-120.64188,117,75,15,3,2,3,19,0,22,1,2,0,37,55,0,0,3,13,0,0,1,0,0,8,0,0,3,5,3,0,0,2,0,0,0,0,1,0,0,2,0,0,0,0,0,1,0,35,0,1,15,3,0,21,"surfrider",NA,NA,NA,NA,NA,NA
42,5641,"Cleanup on 02/13/2021 at Pismo Beach by Unaffiliated with a Surfrider Chapter/Club",2021-02-13,"Unaffiliated with a Surfrider Chapter/Club",2,20,NA,2,"Pismo Beach",35.138267,-120.64188,67,56,0,1,1,9,0,0,5,0,2,0,8,52,0,0,8,0,0,0,0,0,0,3,0,0,0,0,2,0,0,0,0,0,0,0,0,0,0,2,0,0,0,0,0,0,0,8,0,0,0,1,0,43,"surfrider",NA,NA,NA,NA,NA,NA
43,5650,"Cleanup on 02/14/2021 at Pismo Beach by Unaffiliated with a Surfrider Chapter/Club",2021-02-14,"Unaffiliated with a Surfrider Chapter/Club",2,6,NA,2,"Pismo Beach",35.138267,-120.64188,38,29,7,1,0,1,0,0,4,0,1,0,5,28,0,0,0,0,0,0,0,0,0,0,2,0,0,0,1,0,0,2,0,0,0,0,0,0,0,1,0,0,0,0,0,0,0,5,0,0,7,1,0,19,"surfrider",NA,NA,NA,NA,NA,NA
44,6086,"Cleanup on 05/31/2021 at Avila Beach by San Luis Obispo",2021-05-31,"San Luis Obispo",32,225,0.8,2.5,"Avila Beach",35.179166666667,-120.73666666667,966,724,12,33,1,41,155,1,529,15,26,1,68,326,0,0,21,50,0,2,31,4,0,60,38,13,23,119,48,16,3,16,172,1,5,0,9,1,3,22,0,0,0,0,0,2,7,57,0,2,4,11,0,226,"surfrider",NA,NA,NA,NA,NA,NA
45,6375,"Cleanup on 08/07/2021 at South Palisades Park by San Diego",2021-08-07,"San Diego",30,5,1,1,"South Palisades Park",35.16851116,-120.6961441,251,214,0,3,0,1,33,0,109,3,1,0,32,106,0,0,0,2,0,0,1,1,0,18,7,0,21,30,10,0,0,3,18,0,0,0,3,1,0,0,0,0,0,0,0,0,0,30,2,0,0,0,1,103,"surfrider",NA,NA,NA,NA,NA,NA
46,6541,"Cleanup on 09/18/2021 at Surf Beach by San Luis Obispo",2021-09-18,"San Luis Obispo",1,2.5,NA,0.75,"Surf Beach",34.685243807985,-120.606199543456,86,62,1,6,0,9,8,0,18,0,6,0,30,32,0,0,7,7,0,0,0,0,0,5,4,2,2,3,2,0,0,0,3,0,0,0,0,0,4,2,0,0,0,0,0,1,1,27,1,0,1,4,0,10,"surfrider",NA,NA,NA,NA,NA,NA
47,8915,"Cleanup on 11/06/2021 at Morro Rock by California Polytechnic State University",2021-11-06,"California Polytechnic State University",4,2,NA,1,"Morro Rock",35.371666666667,-120.86444444444,85,81,0,0,0,0,4,0,31,0,0,0,18,36,0,0,0,0,0,0,2,0,0,4,3,0,0,4,3,0,0,1,16,0,0,0,0,0,0,0,0,0,0,0,0,0,0,18,0,0,0,0,0,34,"surfrider",NA,NA,NA,NA,NA,NA
48,6962,"Cleanup on 12/03/2021 at Pismo Beach by California Polytechnic State University",2021-12-03,"California Polytechnic State University",1,5,NA,2,"Pismo Beach",35.138267,-120.64188,144,130,0,8,1,1,4,0,62,0,2,0,30,50,0,0,0,0,0,0,8,1,0,7,8,1,1,7,5,4,2,3,15,0,0,0,0,0,0,2,0,0,0,0,0,0,0,30,0,0,0,0,0,50,"surfrider",NA,NA,NA,NA,NA,NA
49,7991,"Cleanup on 03/11/2022 at Grover Beach by California Polytechnic State University",2022-03-11,"California Polytechnic State University",20,2,NA,1,"Grover Beach",35.121611,-120.621306,202,154,2,3,0,8,35,9,82,0,2,1,41,66,0,0,5,28,0,0,11,2,0,13,4,2,4,5,13,0,1,1,28,0,0,0,0,0,0,2,0,0,0,1,0,2,0,40,0,0,1,1,2,36,"surfrider",NA,NA,NA,NA,NA,NA
50,7993,"Cleanup on 03/13/2022 at Morro Strand State Beach by California Polytechnic State University",2022-03-13,"California Polytechnic State University",15,1,NA,1,"Morro Strand State Beach",35.403333333333,-120.86888888889,54,39,2,6,0,3,4,0,8,0,0,0,16,30,0,0,3,1,0,0,1,1,0,0,1,4,0,1,0,0,0,2,10,0,0,0,0,0,0,0,0,0,0,0,0,1,0,15,0,0,2,2,5,5,"surfrider",NA,NA,NA,NA,NA,NA
51,7994,"Cleanup on 04/30/2022 at Morro Strand State Beach by California Polytechnic State University",2022-04-30,"California Polytechnic State University",25,4,NA,1,"Morro Strand State Beach",35.403333333333,-120.86888888889,121,108,2,7,0,1,3,0,29,2,1,0,21,68,0,0,0,0,0,0,4,0,0,2,2,5,0,7,3,0,0,0,6,0,0,2,0,0,0,1,0,0,0,0,0,0,0,21,0,0,1,0,0,67,"surfrider",NA,NA,NA,NA,NA,NA
52,7995,"Cleanup on 05/01/2022 at Grover Beach by California Polytechnic State University",2022-05-01,"California Polytechnic State University",30,5,NA,1.5,"Grover Beach",35.121611,-120.621306,284,232,8,17,0,6,21,0,91,7,2,2,22,160,0,0,1,12,0,0,6,0,0,25,6,5,0,19,2,0,0,0,36,3,1,0,3,0,0,2,0,0,0,1,0,0,0,20,0,2,8,3,0,129,"surfrider",NA,NA,NA,NA,NA,NA
53,7996,"Cleanup on 05/21/2022 at Morro Strand State Beach by California Polytechnic State University",2022-05-21,"California Polytechnic State University",12,2,NA,1,"Morro Strand State Beach",35.403333333333,-120.86888888889,80,67,2,3,0,0,8,0,25,1,0,0,8,46,0,0,0,4,0,0,6,0,0,0,0,1,0,4,1,0,0,0,14,0,0,0,1,0,0,0,0,0,0,0,0,0,0,8,0,0,2,2,0,37,"surfrider",NA,NA,NA,NA,NA,NA
54,8919,"Cleanup on 09/24/2022 at Grover Beach by California Polytechnic State University",2022-09-24,"California Polytechnic State University",30,9,NA,1,"Grover Beach",35.121611,-120.621306,260,176,14,8,0,14,48,1,110,3,10,1,22,113,0,0,8,34,0,0,16,5,0,7,10,3,0,7,8,0,3,1,50,0,0,2,1,0,5,0,0,5,0,1,0,0,0,21,0,1,10,4,0,58,"surfrider",NA,NA,NA,NA,NA,NA
55,8914,"Cleanup on 10/08/2022 at Morro Strand State Beach by California Polytechnic State University",2022-10-08,"California Polytechnic State University",20,6,NA,1,"Morro Strand State Beach",35.403333333333,-120.86888888889,302,208,5,19,0,27,43,0,107,3,1,0,52,138,0,0,26,18,0,0,15,5,0,18,7,6,1,19,5,0,0,0,73,0,1,2,0,0,1,0,0,0,0,0,0,1,6,46,0,0,2,3,2,45,"surfrider",NA,NA,NA,NA,NA,NA
56,8297,"Cleanup on 10/31/2022 at Pismo Beach by San Luis Obispo",2022-10-31,"San Luis Obispo",2,2,5,2,"Pismo Beach",35.138267,-120.64188,10,10,0,0,0,0,0,0,3,0,0,0,2,5,0,0,0,0,0,0,0,0,0,0,1,0,0,0,0,0,0,0,2,0,0,0,0,0,0,0,0,0,0,0,0,0,0,2,0,0,0,0,1,4,"surfrider",NA,NA,NA,NA,NA,NA
57,8298,"Cleanup on 11/01/2022 at Pismo Beach by San Luis Obispo",2022-11-01,"San Luis Obispo",1,1,8,6,"Pismo Beach",35.138267,-120.64188,13,5,0,6,0,0,2,0,9,0,0,1,1,1,0,0,1,0,0,0,0,1,0,0,0,6,0,2,0,0,0,0,0,0,0,0,0,0,0,0,0,0,0,0,0,2,0,0,0,0,0,0,0,1,"surfrider",NA,NA,NA,NA,NA,NA
58,8983,"Cleanup on 11/05/2022 at Morro Rock by California Polytechnic State University",2022-11-05,"California Polytechnic State University",15,4,NA,1,"Morro Rock",35.371666666667,-120.86444444444,77,50,16,1,0,0,10,0,24,2,1,0,8,42,0,0,0,4,0,0,1,0,0,2,1,0,2,6,2,0,0,0,11,0,2,0,0,0,1,0,0,0,0,0,0,0,0,8,0,0,16,1,0,20,"surfrider",NA,NA,NA,NA,NA,NA
59,8917,"Cleanup on 11/12/2022 at Pirate's Cove by California Polytechnic State University",2022-11-12,"California Polytechnic State University",25,5,NA,1,"Pirate's Cove",35.176111111111,-120.71583333333,499,222,138,82,0,1,56,0,238,1,4,0,116,140,0,0,0,7,0,0,7,0,0,48,77,29,9,49,3,1,3,1,27,0,0,1,0,0,3,0,0,1,0,0,0,1,0,115,0,0,72,12,0,33,"surfrider",NA,NA,NA,NA,NA,NA
60,8916,"Cleanup on 11/13/2022 at Grover Beach by California Polytechnic State University",2022-11-13,"California Polytechnic State University",15,7,NA,1,"Grover Beach",35.121611,-120.621306,169,132,0,0,0,2,35,0,46,0,4,1,18,100,0,0,0,34,0,0,10,0,0,4,8,0,4,5,2,0,0,1,12,0,0,0,0,0,3,1,0,0,1,0,0,1,0,17,0,0,0,0,0,66,"surfrider",NA,NA,NA,NA,NA,NA
61,8918,"Cleanup on 12/04/2022 at Morro Rock by California Polytechnic State University",2022-12-04,"California Polytechnic State University",15,5,NA,1,"Morro Rock",35.371666666667,-120.86444444444,59,49,3,1,0,0,6,1,21,1,0,0,6,30,0,0,0,4,0,0,1,0,0,1,0,0,1,3,6,0,0,2,12,0,0,0,1,0,0,0,0,0,0,0,0,0,0,6,0,0,3,1,0,18,"surfrider",NA,NA,NA,NA,NA,NA
62,8985,"Cleanup on 01/28/2023 at Morro Strand State Beach by California Polytechnic State University",2023-01-28,"California Polytechnic State University",20,8,NA,1,"Morro Strand State Beach",35.403333333333,-120.86888888889,349,281,3,28,0,8,29,0,137,3,0,7,74,127,0,0,10,12,0,1,5,7,0,27,15,8,7,22,11,1,0,2,40,0,0,3,0,0,0,0,0,0,5,0,0,1,17,57,0,0,1,13,0,84,"surfrider",NA,NA,NA,NA,NA,NA
63,8984,"Cleanup on 02/04/2023 at Avila Beach by California Polytechnic State University",2023-02-04,"California Polytechnic State University",11,7.2,NA,1,"Avila Beach",35.179166666667,-120.73666666667,376,367,4,3,0,1,1,0,49,0,1,0,16,310,0,0,0,1,0,1,3,0,1,9,2,2,1,1,2,0,0,2,27,0,0,0,0,0,0,0,1,0,0,0,0,0,0,15,0,1,4,1,0,302,"surfrider",NA,NA,NA,NA,NA,NA
64,9055,"Cleanup on 02/05/2023 at Pirate's Cove by California Polytechnic State University",2023-02-05,"California Polytechnic State University",30,56.8,NA,1.5,"Pirate's Cove",35.176111111111,-120.71583333333,782,538,76,98,0,3,67,0,277,4,3,0,93,405,0,0,0,40,0,1,17,7,1,67,61,35,5,30,7,0,1,1,69,0,1,3,0,0,1,0,1,1,0,0,0,0,4,87,0,2,44,15,0,281,"surfrider",NA,NA,NA,NA,NA,NA
65,9120,"Cleanup on 02/26/2023 at Morro Rock by California Polytechnic State University",2023-02-26,"California Polytechnic State University",8,9.08,NA,1,"Morro Rock",35.371666666667,-120.86444444444,108,87,10,2,0,2,7,1,38,1,1,0,2,65,0,0,0,2,0,0,5,0,0,1,3,1,0,4,9,1,2,0,13,0,1,0,0,0,0,1,0,0,0,0,0,0,0,2,0,0,9,0,0,54,"surfrider",NA,NA,NA,NA,NA,NA
66,9121,"Cleanup on 03/12/2023 at Morro Rock by California Polytechnic State University",2023-03-12,"California Polytechnic State University",34,329.53,NA,1,"Morro Rock",35.371666666667,-120.86444444444,484,393,37,11,0,5,38,16,88,25,2,0,18,335,0,0,2,36,2,0,9,1,0,15,13,4,0,13,4,6,0,6,21,0,4,15,6,0,1,0,1,0,0,0,0,0,1,17,0,0,27,5,4,271,"surfrider",NA,NA,NA,NA,NA,NA
67,9348,"Cleanup on 04/30/2023 at Morro Rock by California Polytechnic State University",2023-04-30,"California Polytechnic State University",40,9.98,NA,1,"Morro Rock",35.371666666667,-120.86444444444,292,255,0,5,0,9,23,0,147,2,11,0,33,99,0,0,2,6,0,0,5,0,2,1,10,2,21,24,9,0,1,4,68,0,0,0,2,0,6,5,0,0,0,0,0,0,0,32,0,1,0,3,1,87,"surfrider",NA,NA,NA,NA,NA,NA
68,9679,"Cleanup on 05/28/2023 at Morro Rock by California Polytechnic State University",2023-05-28,"California Polytechnic State University",9,7.9,NA,1,"Morro Rock",35.371666666667,-120.86444444444,83,63,0,5,0,1,14,0,44,0,3,0,4,32,0,0,0,6,0,0,4,0,0,4,3,3,0,9,5,0,0,1,17,0,0,0,0,0,2,1,0,0,0,0,0,0,3,1,0,0,0,1,0,23,"surfrider",NA,NA,NA,NA,NA,NA
69,9945,"Cleanup on 09/16/2023 at Morro Rock by California Polytechnic State University",2023-09-16,"California Polytechnic State University",70,9.92,NA,2,"Morro Rock",35.371666666667,-120.86444444444,256,222,19,7,0,3,5,1,113,0,5,4,29,104,0,0,5,2,0,0,14,2,0,8,10,4,8,3,14,2,0,2,51,0,0,0,0,0,0,5,0,0,0,0,0,0,0,29,0,0,14,0,3,80,"surfrider",NA,NA,NA,NA,NA,NA
1,4907,NA,2016-09-17,"Paradise Dive Club",2,59.61,0,NA,NA,34.46311,-120.09861,395,246,19,15,0,109,0,0,144,79,5,0,97,64,0,0,15,0,NA,0,0,0,0,4,29,15,6,39,5,14,0,15,23,0,79,0,0,NA,5,0,NA,NA,NA,NA,0,0,NA,NA,NA,0,0,0,10,39,"tides",2,0,0.5513,NA,NA,NA
2,4931,NA,2016-09-17,"Explore Ecology",4,64.03,0,NA,NA,34.46347,-120.09909,987,756,81,28,0,72,0,0,270,8,7,2,107,543,0,0,44,0,NA,0,7,0,0,30,86,28,50,16,16,33,0,10,44,0,8,0,0,NA,7,0,NA,NA,NA,NA,0,0,NA,NA,NA,0,0,0,15,486,"tides",4,0,0.0181,NA,NA,NA
3,4951,NA,2016-09-17,"Explore Ecology",6,14.99,0,NA,NA,34.46459,-120.1005,207,134,13,2,0,56,0,0,73,0,5,0,53,74,0,0,44,0,NA,0,9,0,0,2,21,2,2,2,4,4,0,0,29,0,0,0,0,NA,5,0,NA,NA,NA,NA,0,0,NA,NA,NA,0,0,0,7,23,"tides",6,0,2.4521,NA,NA,NA
4,4968,NA,2016-09-17,"none",3,6,0,NA,NA,34.47167,-120.22815,101,65,5,9,0,20,0,0,38,0,1,0,1,59,0,0,18,0,NA,0,6,0,0,7,7,9,2,1,1,1,0,0,6,0,0,0,0,NA,1,0,NA,NA,NA,NA,0,0,NA,NA,NA,0,0,0,1,40,"tides",3,0,0.4876,NA,NA,NA
5,4984,NA,2016-09-17,"Explore Ecology",4,44.85,0,NA,NA,34.46285,-120.07137,449,304,50,24,0,56,0,0,273,11,6,3,27,114,0,0,24,0,NA,0,8,0,0,16,75,24,15,26,2,61,0,6,55,0,11,0,0,NA,6,0,NA,NA,NA,NA,0,0,NA,NA,NA,0,0,0,15,75,"tides",4,0,0.0156,NA,NA,NA
6,4990,NA,2016-09-17,"Yvonne Dunn",4,2.5,0,NA,NA,34.47135,-120.22655,39,26,0,3,0,9,0,0,15,0,1,0,8,14,0,0,0,0,NA,0,2,0,0,7,1,3,1,0,0,0,0,0,2,0,0,0,0,NA,1,0,NA,NA,NA,NA,0,0,NA,NA,NA,0,0,0,8,6,"tides",4,0,0.103,NA,NA,NA
7,4993,NA,2016-09-17,"none",1,2.91,0,NA,NA,34.47138,-120.228,49,31,3,3,0,8,0,0,17,0,0,0,10,18,0,0,5,0,NA,0,1,0,0,3,5,3,4,2,0,0,0,0,3,0,0,0,0,NA,0,0,NA,NA,NA,NA,0,0,NA,NA,NA,0,0,0,3,10,"tides",1,0,0.864,NA,NA,NA
8,5041,NA,2016-09-17,"none",1,0.73,0,NA,NA,34.47157,-120.22781,33,29,0,0,0,4,0,0,4,0,1,0,2,26,0,0,3,0,NA,0,0,0,0,0,0,0,0,0,1,0,0,0,3,0,0,0,0,NA,1,0,NA,NA,NA,NA,0,0,NA,NA,NA,0,0,0,0,23,"tides",1,0,0.1745,NA,NA,NA
9,5066,NA,2016-09-17,"none",1,0.02,0,NA,NA,34.47093,-120.22675,2,2,0,0,0,0,0,0,0,0,0,0,0,2,0,0,0,0,NA,0,0,0,0,0,0,0,0,0,0,0,0,0,0,0,0,0,0,NA,0,0,NA,NA,NA,NA,0,0,NA,NA,NA,0,0,0,0,2,"tides",1,0,0.057,NA,NA,NA
10,5073,NA,2016-09-17,"none",1,0.08,0,NA,NA,34.47117,-120.22767,8,8,0,0,0,0,0,0,0,0,0,0,0,8,0,0,0,0,NA,0,0,0,0,0,0,0,0,0,0,0,0,0,0,0,0,0,0,NA,0,0,NA,NA,NA,NA,0,0,NA,NA,NA,0,0,0,0,8,"tides",1,0,0.0123,NA,NA,NA
11,5096,NA,2016-09-17,"El Capitan",44,25,0,NA,NA,34.45846,-120.02437,200,127,2,10,0,54,0,0,68,9,0,11,47,58,0,0,47,0,NA,0,2,0,0,16,7,10,7,3,3,2,0,6,19,0,9,0,0,NA,0,0,NA,NA,NA,NA,0,0,NA,NA,NA,0,0,0,4,13,"tides",44,0,0.2608,NA,NA,NA
12,5101,NA,2016-09-17,"none",1,0.17,0,NA,NA,34.47122,-120.22786,6,5,0,0,0,1,0,0,2,0,0,0,1,3,0,0,0,0,NA,0,0,0,0,0,0,0,0,0,0,0,0,0,2,0,0,0,0,NA,0,0,NA,NA,NA,NA,0,0,NA,NA,NA,0,0,0,1,2,"tides",1,0,0.0376,NA,NA,NA
13,4946,NA,2016-09-17,"none",4,19,0,NA,NA,35.10186,-120.63037,225,141,0,2,0,81,0,0,48,1,2,6,51,116,0,0,81,0,NA,0,2,0,0,21,5,2,1,1,4,0,0,0,13,0,1,0,0,NA,2,0,NA,NA,NA,NA,0,0,NA,NA,NA,0,0,0,2,38,"tides",4,0,1.2618,NA,NA,NA
14,17844,NA,2016-09-17,"CA Coastal Cleanup Day - San Luis Obispo Co.",1198,6512,0,NA,NA,35.168148575915,-120.69585442543,1,1,0,0,0,0,0,0,0,0,0,0,0,1,0,0,0,0,NA,0,0,0,0,0,0,0,0,0,0,0,0,0,0,0,0,0,0,NA,0,0,NA,NA,NA,NA,0,0,NA,NA,NA,0,0,0,0,1,"tides",1198,0,73,NA,NA,NA
15,7145,NA,2016-10-21,"EcoSlo/Nathan Kargol",1,4.77,0,NA,NA,35.17358,-120.70266,134,102,2,1,0,15,0,0,43,0,0,3,44,30,0,0,15,0,NA,0,11,0,0,0,5,1,14,0,5,0,0,0,21,0,0,0,0,NA,0,0,NA,NA,NA,NA,0,0,NA,NA,NA,0,0,0,1,15,"tides",1,0,1.6335,NA,NA,NA
16,7697,NA,2016-10-29,"EcoSlo/Nathan Kargol",1,1.84,0,NA,NA,35.17395,-120.70278,67,45,0,0,0,12,0,0,8,0,1,2,25,21,0,0,11,0,NA,0,0,0,0,0,0,0,10,0,3,0,0,0,5,0,0,0,0,NA,1,0,NA,NA,NA,NA,0,0,NA,NA,NA,0,0,0,0,10,"tides",1,0,1.585,NA,NA,NA
17,10644,NA,2016-11-06,"EcoSlo/Nathan Kargol",1,1.84,0,NA,NA,35.17351,-120.70261,59,45,0,1,0,12,0,0,7,0,0,0,34,17,0,0,12,0,NA,0,0,0,0,0,0,1,1,1,3,1,0,0,1,0,0,0,0,NA,0,0,NA,NA,NA,NA,0,0,NA,NA,NA,0,0,0,0,5,"tides",1,0,1.6425,NA,NA,NA
18,11265,NA,2016-11-16,"Octonuats (school beach cleanup)",3,6,0,NA,NA,34.46576,-120.06918,75,54,5,6,0,8,0,0,41,0,1,0,6,25,0,0,4,0,NA,0,2,0,0,4,10,6,2,1,2,7,0,3,6,0,0,0,0,NA,1,0,NA,NA,NA,NA,0,0,NA,NA,NA,0,0,0,3,18,"tides",3,0,0.0218,NA,NA,NA
19,12632,NA,2016-11-21,"EcoSlo/Nathan Kargol",1,1.93,0,NA,NA,35.17368,-120.70273,43,20,0,0,0,14,0,0,5,0,0,0,6,23,0,0,13,0,NA,0,0,0,0,0,1,0,9,0,2,0,0,0,2,0,0,0,0,NA,0,0,NA,NA,NA,NA,0,0,NA,NA,NA,0,0,0,1,9,"tides",1,0,1.6947,NA,NA,NA
20,14288,NA,2016-12-21,"EcoSlo/Nathan Kargol",1,5.88,0,NA,NA,35.17419,-120.70281,118,89,5,5,0,18,0,0,45,0,1,0,50,21,0,0,16,0,NA,0,8,0,0,7,11,5,1,6,1,1,0,1,5,0,0,0,0,NA,1,0,NA,NA,NA,NA,0,0,NA,NA,NA,0,0,0,1,4,"tides",1,0,2.9795,NA,NA,NA
21,14299,NA,2016-12-22,"EcoSlo/Nathan Kargol",1,1.92,0,NA,NA,35.17372,-120.70273,29,16,1,1,0,9,0,0,15,0,0,0,3,9,0,0,8,0,NA,0,5,0,0,0,2,1,2,0,1,0,0,0,6,0,0,0,0,NA,0,0,NA,NA,NA,NA,0,0,NA,NA,NA,0,0,0,1,0,"tides",1,0,1.9086,NA,NA,NA
22,14431,NA,2016-12-29,"EcoSlo/Nathan Kargol",1,1.84,0,NA,NA,35.17437,-120.70256,34,24,2,2,0,4,0,0,9,0,0,0,16,7,0,0,4,0,NA,0,0,0,0,0,3,2,2,0,1,0,0,0,3,0,0,0,0,NA,0,0,NA,NA,NA,NA,0,0,NA,NA,NA,0,0,0,0,3,"tides",1,0,1.6287,NA,NA,NA
23,15407,NA,2017-01-29,"EcoSlo/Nathan Kargol",1,9.12,0,NA,NA,35.17373,-120.70264,82,52,9,1,0,19,0,0,53,1,0,2,3,22,0,0,19,0,NA,0,3,0,0,1,11,1,1,0,2,3,0,2,30,0,1,0,0,NA,0,0,NA,NA,NA,NA,0,0,NA,NA,NA,0,0,0,0,4,"tides",1,0,0.9328,NA,NA,NA
24,16352,NA,2017-02-26,"EcoSlo/Nathan Kargol",1,1.6,0,NA,NA,35.17369,-120.70269,37,30,1,0,0,5,0,0,14,0,0,0,13,9,0,0,5,0,NA,0,2,0,0,0,4,0,1,0,2,1,0,1,4,0,0,0,0,NA,0,0,NA,NA,NA,NA,0,0,NA,NA,NA,0,0,0,0,4,"tides",1,0,1.6227,NA,NA,NA
25,16464,NA,2017-03-05,"EcoSlo/Nathan Kargol",1,1.33,0,NA,NA,35.17295,-120.70285,19,7,0,0,0,10,0,0,1,0,0,0,1,15,0,0,10,0,NA,0,0,0,0,0,0,0,2,0,0,1,0,0,0,0,0,0,0,NA,0,0,NA,NA,NA,NA,0,0,NA,NA,NA,0,0,0,0,5,"tides",1,0,1.1052,NA,NA,NA
26,16512,NA,2017-03-06,"EcoSlo/Nathan Kargol",1,2.07,0,NA,NA,35.17352,-120.7023,28,14,1,1,0,11,0,0,11,0,1,0,2,13,0,0,10,0,NA,0,3,0,0,0,2,1,1,0,1,2,0,2,0,0,0,0,0,NA,1,0,NA,NA,NA,NA,0,0,NA,NA,NA,0,0,0,0,3,"tides",1,0,1.7049,NA,NA,NA
27,17688,NA,2017-04-08,"EcoSlo/Nathan Kargol",1,0.75,0,NA,NA,35.17374,-120.70246,21,17,1,0,0,0,0,0,5,0,0,0,12,1,0,0,0,0,NA,0,0,0,0,0,3,0,3,0,0,0,0,1,1,0,0,0,0,NA,0,0,NA,NA,NA,NA,0,0,NA,NA,NA,0,0,0,0,1,"tides",1,0,0.0358,NA,NA,NA
28,17696,NA,2017-04-09,"EcoSlo/Nathan Kargol",1,0.37,0,NA,NA,35.17373,-120.70249,14,12,0,0,0,2,0,0,5,0,0,0,7,2,0,0,2,0,NA,0,2,0,0,0,0,0,0,0,1,0,0,0,2,0,0,0,0,NA,0,0,NA,NA,NA,NA,0,0,NA,NA,NA,0,0,0,0,0,"tides",1,0,0.7912,NA,NA,NA
29,17707,NA,2017-04-10,"EcoSlo/Nathan Kargolh",1,0.09,0,NA,NA,35.174,-120.70259,10,8,0,1,0,0,0,0,2,0,0,0,7,0,0,0,0,0,NA,0,1,0,0,0,0,1,1,0,0,0,0,0,0,0,0,0,0,NA,0,0,NA,NA,NA,NA,0,0,NA,NA,NA,0,0,0,0,0,"tides",1,0,0.1085,NA,NA,NA
30,17743,NA,2017-04-11,"EcoSlo/Nathan Kargol",1,0.34,0,NA,NA,35.17374,-120.70247,11,8,0,0,0,2,0,0,3,0,0,0,4,3,0,0,2,0,NA,0,0,0,0,0,0,0,1,0,1,0,0,0,2,0,0,0,0,NA,0,0,NA,NA,NA,NA,0,0,NA,NA,NA,0,0,0,0,1,"tides",1,0,0.3947,NA,NA,NA
31,17744,NA,2017-04-11,"EcoSlo/Nathan Kargol",1,0.52,0,NA,NA,35.17374,-120.7025,8,3,0,0,0,4,0,0,2,0,0,0,1,4,0,0,4,0,NA,0,0,0,0,0,0,0,1,0,1,0,0,0,1,0,0,0,0,NA,0,0,NA,NA,NA,NA,0,0,NA,NA,NA,0,0,0,0,0,"tides",1,0,1.1993,NA,NA,NA
32,17782,NA,2017-04-12,"EcoSlo/Nathan Kargol",1,0.64,0,NA,NA,35.17368,-120.70268,30,22,0,1,0,3,0,0,7,0,0,1,14,4,0,0,3,0,NA,0,0,0,0,1,0,1,4,0,1,0,0,0,4,0,0,0,0,NA,0,0,NA,NA,NA,NA,0,0,NA,NA,NA,0,0,0,0,1,"tides",1,0,0.708,NA,NA,NA
33,19701,NA,2017-06-25,"none",1,0.23,0,NA,NA,35.54343,-121.08429,6,5,0,0,0,1,0,0,4,0,0,0,0,2,0,0,1,0,NA,0,1,0,0,0,1,0,0,0,1,0,0,0,1,0,0,0,0,NA,0,0,NA,NA,NA,NA,0,0,NA,NA,NA,0,0,0,0,1,"tides",1,0,0.0045,NA,NA,NA
34,20760,NA,2017-08-09,"none",1,2,0,NA,NA,35.167894308077,-120.69542527199,4,3,0,1,0,0,0,0,4,0,0,0,0,0,0,0,0,0,NA,0,0,0,0,0,0,1,0,0,1,2,0,0,0,0,0,0,0,NA,0,0,NA,NA,NA,NA,0,0,NA,NA,NA,0,0,0,0,0,"tides",1,0,0.75,1,NA,NA
35,22491,NA,2017-09-16,"Gs 50507",3,1.69,0,NA,NA,34.47166,-120.22814,79,62,0,0,0,10,0,0,19,0,2,0,23,28,0,0,4,0,NA,0,3,0,0,3,0,0,7,0,0,0,0,1,12,0,0,0,0,NA,2,0,NA,NA,NA,NA,0,0,NA,NA,NA,0,0,0,4,20,"tides",3,0,0.0212,NA,NA,NA
36,22522,NA,2017-09-16,"Gs 50507",5,0.41,0,NA,NA,34.47163,-120.22822,40,36,0,0,0,1,0,0,11,0,1,0,21,4,0,0,0,0,NA,0,0,0,0,3,0,0,3,0,0,0,0,3,5,0,0,0,0,NA,1,0,NA,NA,NA,NA,0,0,NA,NA,NA,0,0,0,0,4,"tides",5,0,0.1199,NA,NA,NA
37,22563,NA,2017-09-16,"Gs 50507",1,1.34,0,NA,NA,34.47157,-120.22816,48,32,0,0,0,13,0,0,4,0,1,0,26,14,0,0,2,0,NA,0,0,0,0,3,0,0,3,0,0,0,0,1,0,0,0,0,0,NA,1,0,NA,NA,NA,NA,0,0,NA,NA,NA,0,0,0,10,2,"tides",1,0,0.0061,NA,NA,NA
38,22696,NA,2017-09-16,"Gs 50507",3,1.3,0,NA,NA,34.47149,-120.22805,38,27,0,0,0,9,0,0,14,0,3,0,7,12,0,0,6,0,NA,0,3,0,0,0,0,0,2,0,0,0,0,1,10,0,0,0,0,NA,3,0,NA,NA,NA,NA,0,0,NA,NA,NA,0,0,0,0,6,"tides",3,0,0.0404,NA,NA,NA
39,22934,NA,2017-09-16,"El Capitan",1,30.82,0,NA,NA,34.45826,-120.02431,377,236,8,16,0,106,0,0,140,6,0,33,9,178,0,0,90,0,NA,0,2,0,0,15,29,16,11,12,3,6,0,3,54,0,6,0,0,NA,0,0,NA,NA,NA,NA,0,0,NA,NA,NA,0,0,0,25,78,"tides",1,0,1.291,NA,NA,NA
40,22976,NA,2017-09-16,"Chevre chico's",1,2.16,0,NA,NA,34.47125,-120.22787,38,27,0,2,0,9,0,0,16,1,0,1,1,19,0,0,8,0,NA,0,0,0,0,0,5,2,0,1,1,0,0,0,7,0,1,0,0,NA,0,0,NA,NA,NA,NA,0,0,NA,NA,NA,0,0,0,0,11,"tides",1,0,0.8392,NA,NA,NA
41,23000,NA,2017-09-16,"Ernest Righetti High School Key Club",9,5.09,0,NA,NA,34.96484,-120.65023,57,21,0,0,0,36,0,0,7,1,0,0,2,47,0,0,35,0,NA,0,2,0,0,0,2,0,0,0,0,0,0,0,3,0,1,0,0,NA,0,0,NA,NA,NA,NA,0,0,NA,NA,NA,0,0,0,0,12,"tides",9,0,0.6681,NA,NA,NA
42,23054,NA,2017-09-16,"Chevre Chico's",1,3.35,0,NA,NA,34.47111,-120.22819,63,49,2,0,0,12,0,0,33,0,1,0,4,25,0,0,7,0,NA,0,1,0,0,7,5,0,0,1,0,6,0,0,13,0,0,0,0,NA,1,0,NA,NA,NA,NA,0,0,NA,NA,NA,0,0,0,4,14,"tides",1,0,0,NA,NA,NA
43,23090,NA,2017-09-16,"Girlpower",5,15.99,0,NA,NA,34.47165,-120.22814,149,96,22,6,0,23,0,0,52,2,0,0,30,63,0,0,21,0,NA,0,1,0,0,9,24,6,2,10,1,0,0,0,1,0,2,0,0,NA,0,0,NA,NA,NA,NA,0,0,NA,NA,NA,0,0,0,0,42,"tides",5,0,0.6411,NA,NA,NA
44,23134,NA,2017-09-16,"Frank Chen, Daniel Su",2,1.31,0,NA,NA,34.47165,-120.22807,23,12,0,0,0,10,0,0,9,0,0,0,0,13,0,0,9,0,NA,0,0,0,0,3,0,0,1,0,2,0,0,1,3,0,0,0,0,NA,0,0,NA,NA,NA,NA,0,0,NA,NA,NA,0,0,0,1,3,"tides",2,0,0.4073,NA,NA,NA
45,26875,NA,2017-09-16,"Santa Barbara County Coastal Cleanup Day 2017",52,99.48,0,NA,NA,34.470618162654,-120.21858215332,1096,883,64,72,0,11,34,0,563,10,16,3,186,286,0,0,0,0,NA,2,74,2,0,83,102,37,32,43,39,17,0,15,149,0,0,1,9,NA,4,0,NA,NA,NA,NA,0,0,NA,NA,NA,0,11,0,0,275,"tides",52,0,2,NA,NA,NA
46,26881,NA,2017-09-16,"Santa Barbara County Coastal Cleanup Day 2017",15,27,0,NA,NA,34.463046473639,-120.06927967072,510,399,43,29,0,13,17,5,280,3,8,2,34,169,5,0,0,0,NA,0,36,2,0,36,61,10,9,43,11,14,0,19,51,0,0,0,3,NA,0,0,NA,NA,NA,NA,0,3,NA,NA,NA,0,6,0,0,160,"tides",15,0,2,NA,NA,NA
47,26983,NA,2017-09-16,"Environmental Center of San Luis Obispo",59,114.7,0,NA,NA,35.455496423497,-120.91578483582,1081,898,46,65,0,31,4,13,394,24,15,5,281,312,13,0,0,0,NA,0,20,1,0,136,64,9,37,3,18,33,0,9,101,1,0,11,12,NA,0,0,NA,NA,NA,NA,0,14,NA,NA,NA,2,6,0,16,290,"tides",46,13,2,7,NA,NA
48,26984,NA,2017-09-16,"Environmental Center of San Luis Obispo",40,70,0,NA,NA,35.434501770045,-120.89377462864,783,702,40,12,0,16,12,13,231,12,3,2,162,359,12,0,1,0,NA,0,57,8,0,23,31,12,1,7,13,14,0,2,65,0,0,0,12,NA,0,0,NA,NA,NA,NA,0,1,NA,NA,NA,2,27,0,21,310,"tides",27,13,2,26,NA,NA
49,26986,NA,2017-09-16,"Environmental Center of San Luis Obispo",24,390,0,NA,NA,35.414974976048,-120.87459951639,1084,676,232,60,0,90,17,40,493,3,18,35,184,302,39,0,1,0,NA,2,51,12,0,90,111,33,9,29,13,23,0,16,113,0,0,0,3,NA,2,0,NA,NA,NA,NA,0,5,NA,NA,NA,0,153,0,8,141,"tides",14,10,3,20,NA,NA
50,26988,NA,2017-09-16,"Environmental Center of San Luis Obispo",22,40,0,NA,NA,35.391988757565,-120.86308479309,406,352,13,21,0,14,6,11,118,4,2,4,131,136,11,0,0,0,NA,0,10,6,0,23,10,13,0,0,5,0,0,1,50,0,0,2,2,NA,0,0,NA,NA,NA,NA,0,2,NA,NA,NA,7,11,0,4,121,"tides",20,2,1,3,NA,NA
51,26990,NA,2017-09-16,"Environmental Center of San Luis Obispo",40,228.5,0,NA,NA,35.380267942529,-120.8545768261,2467,1992,119,93,0,75,113,44,829,22,14,23,1174,286,44,0,0,0,NA,4,45,47,0,171,129,51,75,103,68,26,0,21,164,0,0,14,8,NA,1,0,NA,NA,NA,NA,0,170,NA,NA,NA,9,54,0,19,213,"tides",34,6,2,41,NA,NA
52,26991,NA,2017-09-16,"Environmental Center of San Luis Obispo",62,140,0,NA,NA,35.372954690793,-120.8619260788,3624,2749,579,148,0,29,47,22,1156,107,10,7,1024,1226,22,0,0,0,NA,14,67,10,0,259,150,45,72,90,82,74,0,34,337,0,0,73,34,NA,3,0,NA,NA,NA,NA,0,5,NA,NA,NA,4,504,0,104,612,"tides",56,6,2,28,NA,NA
53,26992,NA,2017-09-16,"Environmental Center of San Luis Obispo",16,84,0,NA,NA,35.374494377818,-120.85958719254,687,473,126,27,0,46,13,40,152,71,2,6,18,396,40,0,0,0,NA,0,20,9,0,35,16,12,2,17,11,9,0,5,19,1,0,28,42,NA,0,0,NA,NA,NA,NA,0,1,NA,NA,NA,0,121,0,32,242,"tides",16,0,4,9,NA,NA
54,26993,NA,2017-09-16,"Environmental Center of San Luis Obispo",15,66,0,NA,NA,35.374074466088,-120.8533000946,1136,1007,15,46,0,36,20,29,326,49,0,3,481,236,26,0,2,0,NA,0,10,4,0,71,27,13,12,19,58,3,0,5,116,8,0,11,30,NA,0,0,NA,NA,NA,NA,0,3,NA,NA,NA,0,11,0,39,186,"tides",15,0,2,5,NA,NA
55,26995,NA,2017-09-16,"Environmental Center of San Luis Obispo",35,834,0,NA,NA,35.274231019238,-120.88301360607,1298,852,282,47,0,100,12,59,287,165,23,23,60,676,59,0,0,0,NA,0,45,7,0,64,31,20,5,7,11,10,0,3,91,18,0,42,105,NA,0,0,NA,NA,NA,NA,0,1,NA,NA,NA,1,276,0,71,327,"tides",33,2,19,17,NA,NA
56,26998,NA,2017-09-16,"Environmental Center of San Luis Obispo",44,72,0,NA,NA,35.178394814854,-120.73431193829,2401,2096,87,124,0,51,29,49,961,24,5,9,447,892,48,0,0,0,NA,0,50,21,0,278,70,21,14,36,107,21,0,46,319,1,0,7,16,NA,3,0,NA,NA,NA,NA,0,9,NA,NA,NA,1,58,0,70,756,"tides",32,12,4,18,NA,NA
57,27000,NA,2017-09-16,"Environmental Center of San Luis Obispo",53,975,0,NA,NA,35.178999897412,-120.7363986969,3533,2378,561,565,0,29,0,0,1964,5,38,1,1227,298,0,0,0,0,NA,4,0,0,0,699,605,94,0,0,78,197,0,0,287,0,0,1,4,NA,9,0,NA,NA,NA,NA,0,17,NA,NA,NA,1,159,0,0,139,"tides",45,8,1,87,NA,NA
58,27001,NA,2017-09-16,"Environmental Center of San Luis Obispo",33,100.5,0,NA,NA,35.162090967766,-120.68768978119,1068,855,86,69,0,34,18,28,487,16,2,3,347,179,27,0,0,0,NA,0,27,16,0,82,65,33,6,9,33,3,0,2,218,4,0,10,2,NA,0,0,NA,NA,NA,NA,0,7,NA,NA,NA,1,43,0,5,130,"tides",22,11,2,25,NA,NA
59,27002,NA,2017-09-16,"Environmental Center of San Luis Obispo",94,101,0,NA,NA,35.138537145507,-120.64379274845,3009,2734,57,135,0,14,31,12,949,9,4,5,1396,596,10,0,2,0,NA,2,59,25,0,318,55,3,38,11,132,31,0,26,287,0,0,4,5,NA,3,0,NA,NA,NA,NA,0,10,NA,NA,NA,0,37,0,110,449,"tides",75,19,3,12,NA,NA
60,27003,NA,2017-09-16,"Environmental Center of San Luis Obispo",79,49,0,NA,NA,35.134229172893,-120.63597679138,2502,2237,92,73,0,37,38,14,715,15,6,23,767,937,13,0,0,0,NA,2,43,22,0,230,39,4,25,36,79,9,0,16,238,0,0,4,11,NA,1,0,NA,NA,NA,NA,0,23,NA,NA,NA,3,86,0,183,665,"tides",69,10,0.75,2,NA,NA
61,27004,NA,2017-09-16,"Environmental Center of San Luis Obispo",159,395,0,NA,NA,35.120821233492,-120.63490390778,6818,5308,991,238,0,118,89,21,2457,31,31,79,1804,2321,19,0,0,0,NA,1,141,45,0,338,1057,106,74,86,125,77,0,63,450,16,0,1,14,NA,8,0,NA,NA,NA,NA,0,54,NA,NA,NA,9,659,0,68,1562,"tides",59,100,1.5,102,NA,NA
62,27005,NA,2017-09-16,"Environmental Center of San Luis Obispo",75,488,0,NA,NA,35.079179379831,-120.61623573303,4275,3078,618,264,0,131,111,46,1762,33,17,145,565,1634,46,0,0,0,NA,2,196,29,0,380,373,79,73,191,67,33,0,49,373,4,0,11,18,NA,10,0,NA,NA,NA,NA,0,21,NA,NA,NA,6,399,0,45,1180,"tides",67,8,6,49,NA,NA
63,27008,NA,2017-09-16,"Environmental Center of San Luis Obispo",24,47,0,NA,NA,35.028748843348,-120.62234044075,427,353,45,21,0,2,5,2,190,12,0,5,49,168,2,0,0,0,NA,1,11,3,0,37,39,9,1,5,9,5,0,1,70,0,0,3,9,NA,0,0,NA,NA,NA,NA,0,4,NA,NA,NA,0,19,0,3,146,"tides",24,0,5,15,NA,NA
64,27715,NA,2017-09-16,"none",1,0.75,0,NA,NA,35.380792791563,-120.86402893066,296,24,261,0,0,10,1,5,6,2,0,5,8,270,5,0,0,0,NA,0,0,0,0,0,1,0,0,1,0,0,0,0,4,0,0,1,1,NA,0,0,NA,NA,NA,NA,0,0,NA,NA,NA,0,260,0,1,9,"tides",1,0,1,1,NA,NA
65,34472,NA,2017-09-16,"CA Coastal Cleanup Day - San Luis Obispo Co. difference",1,225,0,NA,NA,35.208833367406,-120.85235595834,1,1,0,0,0,0,0,0,0,0,0,0,0,1,0,0,0,0,NA,0,0,0,0,0,0,0,0,0,0,0,0,0,0,0,0,0,0,NA,0,0,NA,NA,NA,NA,0,0,NA,NA,NA,0,0,0,0,1,"tides",1,0,0.1,NA,NA,NA
66,27623,NA,2017-10-14,"Environmental Center of San Luis Obispo",30,100,0,NA,NA,35.179561129381,-120.71232318878,1316,967,74,144,0,7,122,5,576,4,5,0,632,92,2,0,3,0,NA,0,36,3,0,174,83,16,2,138,22,14,0,10,84,1,0,1,2,NA,4,0,NA,NA,NA,NA,0,6,NA,NA,NA,0,21,0,13,54,"tides",30,0,0.75,13,NA,NA
67,29978,NA,2017-12-12,"none",1,0.38,0,NA,NA,35.12083,-120.62634,18,15,0,0,0,2,0,0,1,0,0,1,2,13,0,0,2,0,NA,0,0,0,0,1,0,0,1,0,0,0,0,0,0,0,0,0,0,NA,0,0,NA,NA,NA,NA,0,0,NA,NA,NA,0,0,0,0,11,"tides",1,0,0.5281,NA,NA,NA
68,34286,NA,2018-02-09,"Oceano",1,0.25,0,NA,NA,35.10326,-120.63073,7,5,0,2,0,0,0,0,6,0,0,0,1,0,0,0,0,0,NA,0,0,0,0,0,2,2,0,1,0,1,0,0,0,0,0,0,0,NA,0,0,NA,NA,NA,NA,0,0,NA,NA,NA,0,0,0,0,0,"tides",1,0,0,NA,NA,NA
69,34496,NA,2018-02-15,"Pismo",1,0.63,0,NA,NA,35.13674,-120.63964,27,22,0,0,0,2,0,0,16,0,0,0,2,6,0,0,1,0,NA,0,6,0,0,3,2,0,3,0,2,2,0,0,1,0,0,0,0,NA,0,0,NA,NA,NA,NA,0,0,NA,NA,NA,0,0,0,1,4,"tides",1,0,0,NA,NA,NA
70,34696,NA,2018-02-19,"Environmental Center of San Luis Obispo",6,41,0,NA,NA,35.174930849749,-120.7164645195,421,235,102,66,0,5,13,2,197,2,5,3,148,64,2,0,0,0,NA,4,3,2,0,55,68,26,0,13,5,0,0,5,17,0,0,0,2,NA,3,0,NA,NA,NA,NA,0,1,NA,NA,NA,0,50,0,2,11,"tides",6,0,1,3,NA,NA
71,34750,NA,2018-02-22,"Pismo",1,5.58,0,NA,NA,35.12544,-120.63664,78,57,5,10,0,6,0,0,60,0,0,3,5,10,0,0,6,0,NA,0,10,0,0,6,8,10,0,0,6,5,0,4,11,0,0,0,0,NA,0,0,NA,NA,NA,NA,0,0,NA,NA,NA,0,0,0,2,4,"tides",1,0,0,NA,NA,NA
72,35435,NA,2018-03-17,"Environmental Center of San Luis Obispo",18,49.5,0,NA,NA,35.121453070767,-120.62447547913,534,452,43,21,0,8,7,3,166,1,3,6,249,103,3,0,0,0,NA,0,39,7,0,37,24,8,3,9,5,0,0,8,30,0,0,0,1,NA,0,0,NA,NA,NA,NA,0,1,NA,NA,NA,3,28,0,16,58,"tides",10,8,2,4,NA,NA
73,35426,NA,2018-03-19,"Son of a Beach",1,2.32,0,NA,NA,35.12238,-120.63334,48,35,1,1,0,10,0,0,24,0,1,0,9,13,0,0,9,0,NA,0,0,0,0,1,4,1,1,1,6,2,0,0,9,0,0,0,0,NA,1,0,NA,NA,NA,NA,0,0,NA,NA,NA,0,0,0,0,4,"tides",1,0,0.442,NA,NA,NA
74,35428,NA,2018-03-19,"Son of a beach",20,2.41,0,NA,NA,35.07904,-120.62942,27,15,1,0,0,11,0,0,15,1,0,0,1,10,0,0,9,0,NA,0,1,0,0,7,3,0,0,1,1,0,0,2,0,0,1,0,0,NA,0,0,NA,NA,NA,NA,0,0,NA,NA,NA,0,0,0,1,0,"tides",20,0,0.1729,NA,NA,NA
75,36167,NA,2018-04-07,"none",1,0.14,0,NA,NA,35.42072,-120.8785,8,8,0,0,0,0,0,0,4,0,0,0,2,2,0,0,0,0,NA,0,0,0,0,1,1,0,0,0,0,0,0,0,2,0,0,0,0,NA,0,0,NA,NA,NA,NA,0,0,NA,NA,NA,0,0,0,0,2,"tides",1,0,0.1146,NA,NA,NA
76,36318,NA,2018-04-10,"none",1,0.7,0,NA,NA,35.42066,-120.8781,4,2,0,0,0,2,0,0,1,1,0,0,1,1,0,0,1,0,NA,0,0,0,0,0,0,0,0,0,0,0,0,0,1,0,1,0,0,NA,0,0,NA,NA,NA,NA,0,0,NA,NA,NA,0,0,0,0,0,"tides",1,0,0,NA,NA,NA
77,36630,NA,2018-04-14,"Environmental Center of San Luis Obispo",22,68,0,NA,NA,35.378973300314,-120.86450099945,712,552,76,29,0,19,30,5,228,7,7,6,100,353,5,0,0,0,NA,0,10,4,0,73,8,9,6,33,16,4,0,1,71,2,0,2,3,NA,0,0,NA,NA,NA,NA,0,4,NA,NA,NA,1,73,0,26,253,"tides",18,4,1,6,NA,NA
78,40995,NA,2018-04-28,"Environmental Group of San Luis Obispo",20,23,0,NA,NA,35.359045082785,-120.85125636209,827,742,49,9,0,11,8,8,184,9,3,0,549,66,8,0,0,0,NA,0,27,8,0,22,7,3,8,3,12,4,0,5,93,0,0,1,8,NA,0,0,NA,NA,NA,NA,0,0,NA,NA,NA,0,46,0,4,16,"tides",15,5,2,5,NA,NA
79,40996,NA,2018-04-28,"Environmental Group of San Luis Obispo",21,153,0,NA,NA,35.174982967623,-120.71707882009,1761,785,450,413,0,12,72,9,949,6,8,1,315,444,9,0,0,0,NA,4,30,29,0,370,196,91,29,62,17,37,0,14,101,1,0,1,4,NA,5,0,NA,NA,NA,NA,0,10,NA,NA,NA,4,288,0,15,139,"tides",21,0,2,25,NA,NA
80,37474,NA,2018-05-05,"Environmental Center of San Luis Obispo",27,85,0,NA,NA,35.121979598087,-120.63295125961,1464,1198,62,106,0,11,55,2,618,18,6,0,465,323,2,0,0,0,NA,0,45,33,0,138,65,40,32,46,48,15,0,14,176,8,0,0,10,NA,5,0,NA,NA,NA,NA,0,5,NA,NA,NA,9,36,0,41,244,"tides",25,2,3,10,NA,NA
81,37437,NA,2018-05-08,"none",1,0.54,0,NA,NA,35.42461,-120.88081,1,0,0,0,0,1,0,0,0,1,0,0,0,0,0,0,0,0,NA,0,0,0,0,0,0,0,0,0,0,0,0,0,0,0,1,0,0,NA,0,0,NA,NA,NA,NA,0,0,NA,NA,NA,0,0,0,0,0,"tides",1,0,0,NA,NA,NA
82,74213,NA,2018-05-23,"Keep By The Sea",24,8,0,NA,NA,35.123418243437,-120.63350891605,213,182,17,3,0,7,2,7,56,0,0,0,56,92,7,0,0,0,NA,0,6,1,0,9,3,0,2,2,0,0,0,3,32,0,0,0,0,NA,0,0,NA,NA,NA,NA,0,0,NA,NA,NA,0,17,0,0,75,"tides",4,20,0.25,NA,NA,NA
83,39750,NA,2018-05-29,"Environmental Center of San Luis Obispo",23,450,0,NA,NA,35.175671494016,-120.71917272522,1526,793,451,220,0,6,33,0,848,1,18,0,322,314,0,0,0,0,NA,5,20,5,0,180,334,88,23,69,29,11,0,7,106,0,0,0,1,NA,12,0,NA,NA,NA,NA,0,11,NA,NA,NA,0,171,0,4,133,"tides",23,0,1,27,NA,NA
84,38687,NA,2018-06-02,"Environmental Center of San Luis Obispo",24,25,0,NA,NA,35.266705017078,-120.8853222783,178,157,11,4,0,5,0,4,80,9,0,4,11,69,4,0,0,0,NA,0,8,0,0,5,0,2,1,1,5,3,0,0,56,1,0,0,8,NA,0,0,NA,NA,NA,NA,0,1,NA,NA,NA,1,11,0,9,49,"tides",19,5,2,2,NA,NA
85,40973,NA,2018-06-09,"Environmental Center of San Luis Obispo",81,87,0,NA,NA,35.179270984203,-120.73702635701,3982,3641,102,129,0,34,43,26,1547,10,12,30,1274,1050,24,0,27,0,NA,0,42,10,0,302,129,40,33,82,121,23,0,77,722,1,0,2,7,NA,3,0,NA,NA,NA,NA,0,7,NA,NA,NA,4,64,0,135,850,"tides",81,0,2,18,NA,NA
86,39081,NA,2018-06-25,"none",1,0.02,0,NA,NA,35.42121,-120.87786,2,2,0,0,0,0,0,0,0,0,0,1,0,1,0,0,0,0,NA,0,0,0,0,0,0,0,0,0,0,0,0,0,0,0,0,0,0,NA,0,0,NA,NA,NA,NA,0,0,NA,NA,NA,0,0,0,0,1,"tides",1,0,0.0066,NA,NA,NA
87,39270,NA,2018-06-30,"John",1,8.34,0,NA,NA,35.15301,-120.67324,103,72,0,14,0,16,0,0,52,3,2,11,20,14,0,0,11,0,NA,0,3,0,0,4,11,14,1,3,8,2,0,0,7,0,3,0,0,NA,2,0,NA,NA,NA,NA,0,0,NA,NA,NA,0,0,0,8,3,"tides",1,0,0.0954,NA,NA,NA
88,39275,NA,2018-06-30,"none",1,0.07,0,NA,NA,35.43398,-120.88658,7,7,0,0,0,0,0,0,1,0,0,0,4,2,0,0,0,0,NA,0,0,0,0,0,0,0,0,0,0,0,0,0,1,0,0,0,0,NA,0,0,NA,NA,NA,NA,0,0,NA,NA,NA,0,0,0,0,2,"tides",1,0,0.0397,NA,NA,NA
89,39437,NA,2018-07-05,"none",1,0.68,0,NA,NA,35.42086,-120.8778,11,9,0,0,0,1,0,0,4,1,0,0,4,1,0,0,0,0,NA,0,0,0,0,0,1,0,1,1,1,0,0,0,1,0,1,0,0,NA,0,0,NA,NA,NA,NA,0,0,NA,NA,NA,0,0,0,0,1,"tides",1,0,0.0324,NA,NA,NA
90,39442,NA,2018-07-05,"none",1,0.14,0,NA,NA,35.41072,-120.87399,3,2,0,0,0,1,0,0,0,0,0,0,0,3,0,0,1,0,NA,0,0,0,0,0,0,0,0,0,0,0,0,0,0,0,0,0,0,NA,0,0,NA,NA,NA,NA,0,0,NA,NA,NA,0,0,0,0,2,"tides",1,0,0.0329,NA,NA,NA
91,39755,NA,2018-07-05,"Environmental Center of San Luis Obispo",23,891,0,NA,NA,35.175601336875,-120.71943021729,3046,1790,659,385,0,54,106,20,1478,31,35,16,769,645,18,0,2,0,NA,15,61,32,0,415,385,100,52,188,24,49,0,28,184,1,0,23,7,NA,14,0,NA,NA,NA,NA,0,18,NA,NA,NA,1,366,0,31,245,"tides",21,2,1,35,NA,NA
92,39756,NA,2018-07-05,"Environmental Center of San Luis Obispo",19,84,0,NA,NA,35.44867054262,-120.90637161189,895,591,14,77,0,200,4,0,372,4,0,217,247,46,0,0,17,0,NA,0,0,3,0,68,36,34,9,12,35,11,0,21,154,0,0,1,3,NA,0,0,NA,NA,NA,NA,0,2,NA,NA,NA,0,1,0,23,20,"tides",18,1,1,NA,NA,NA
93,40210,NA,2018-07-22,"none",1,0.12,0,NA,NA,35.42087,-120.87805,5,5,0,0,0,0,0,0,4,0,0,0,1,0,0,0,0,0,NA,0,0,0,0,1,1,0,0,0,0,0,0,0,2,0,0,0,0,NA,0,0,NA,NA,NA,NA,0,0,NA,NA,NA,0,0,0,0,0,"tides",1,0,0.058,NA,NA,NA
94,40225,NA,2018-07-22,"Evening Patrol",1,0.24,0,NA,NA,35.16867,-120.69552,7,6,0,0,0,1,0,0,3,0,0,0,3,1,0,0,1,0,NA,0,1,0,0,0,0,0,0,0,0,1,0,0,1,0,0,0,0,NA,0,0,NA,NA,NA,NA,0,0,NA,NA,NA,0,0,0,0,0,"tides",1,0,0.0061,NA,NA,NA
95,40942,NA,2018-08-04,"Environmental Center of San Luis Obispo",28,65,0,NA,NA,35.369691815602,-120.86582735181,2618,2343,106,84,0,20,35,8,636,37,7,14,1155,731,7,0,1,0,NA,0,26,20,0,144,24,24,30,27,70,12,0,27,262,0,0,24,13,NA,4,0,NA,NA,NA,NA,0,9,NA,NA,NA,1,97,0,86,548,"tides",21,7,0.5,6,NA,NA
96,50959,NA,2018-08-17,"The Environmental Center of San Luis Obispo",27,180,0,NA,NA,35.1798322143,-120.72878661091,2805,2442,102,153,0,31,48,20,1139,10,12,27,1229,339,20,0,18,0,NA,0,102,1,0,272,146,54,29,92,107,37,0,109,220,3,0,5,2,NA,6,0,NA,NA,NA,NA,0,5,NA,NA,NA,3,27,0,35,276,"tides",27,0,1,12,NA,NA
97,52381,NA,2018-08-28,"Keep By The Sea",92,37.9,0,NA,NA,35.123440595543,-120.63351428047,183,162,4,10,0,2,4,0,63,0,0,4,90,25,0,0,2,0,NA,0,2,3,0,14,6,4,1,1,2,0,0,5,26,0,0,0,0,NA,0,0,NA,NA,NA,NA,0,0,NA,NA,NA,0,1,0,0,24,"tides",12,80,0.25,NA,NA,NA
98,48561,NA,2018-08-29,"Keep By The Sea",22,9,0,NA,NA,35.123400938563,-120.63356088119,193,189,0,3,0,1,0,0,65,3,0,2,94,29,0,0,1,0,NA,0,0,0,0,3,3,3,0,0,1,0,0,0,55,0,0,0,3,NA,0,0,NA,NA,NA,NA,0,0,NA,NA,NA,0,0,0,0,29,"tides",4,18,0.25,NA,NA,NA
99,48563,NA,2018-08-30,"Keep By The Sea",22,4,0,NA,NA,35.123400938563,-120.63356088119,339,334,0,0,0,5,0,0,51,0,0,5,187,96,0,0,0,0,NA,0,0,0,0,2,0,0,0,0,0,0,0,0,49,0,0,0,0,NA,0,0,NA,NA,NA,NA,0,0,NA,NA,NA,0,0,0,0,96,"tides",4,18,0.25,NA,NA,NA
100,50958,NA,2018-09-01,"The Environmental Center of San Luis Obispo",18,20,0,NA,NA,35.442970666654,-120.89390212742,950,808,54,45,0,28,6,24,275,8,0,6,467,161,24,0,0,0,NA,0,18,1,0,68,17,15,9,12,30,3,0,7,105,0,0,6,2,NA,0,0,NA,NA,NA,NA,0,6,NA,NA,NA,3,52,0,31,77,"tides",16,2,0.5,5,NA,NA
101,48568,NA,2018-09-06,"Keep By The Sea",23,6,0,NA,NA,35.123400938563,-120.63356088119,120,113,0,7,0,0,0,0,44,0,0,0,42,34,0,0,0,0,NA,0,0,0,0,22,2,7,0,0,0,0,0,0,13,0,0,0,0,NA,0,0,NA,NA,NA,NA,0,0,NA,NA,NA,0,0,0,0,34,"tides",4,19,0.25,NA,NA,NA
102,48570,NA,2018-09-06,"Keep By The Sea",21,25,0,NA,NA,35.123400938563,-120.63356088119,417,375,0,41,0,1,0,0,98,0,0,2,245,72,0,0,0,0,NA,0,0,0,0,11,6,41,0,0,5,2,0,0,33,0,0,0,0,NA,0,0,NA,NA,NA,NA,0,0,NA,NA,NA,0,0,0,0,72,"tides",4,17,0.25,NA,NA,NA
103,48581,NA,2018-09-11,"Keep By The Sea",44,12,0,NA,NA,35.123440822455,-120.63348606641,474,446,26,2,0,0,0,0,155,1,0,0,208,110,0,0,0,0,NA,0,0,0,0,32,9,2,0,3,9,0,0,8,92,0,0,0,1,NA,0,0,NA,NA,NA,NA,0,0,NA,NA,NA,0,26,0,0,84,"tides",8,36,0.25,NA,NA,NA
104,44789,NA,2018-09-15,"Parasols in Paradise",1,13.94,0,NA,NA,34.45824,-120.02447,212,146,5,15,0,44,0,0,71,4,0,5,18,112,0,0,32,0,NA,0,3,0,0,18,12,15,2,4,1,1,0,0,17,0,4,0,0,NA,0,0,NA,NA,NA,NA,0,0,NA,NA,NA,0,0,0,13,72,"tides",1,0,5.6637,NA,NA,NA
105,44810,NA,2018-09-15,"dunn school",3,1.52,0,NA,NA,34.47159,-120.2281,35,26,1,2,0,6,0,0,14,0,1,0,2,18,0,0,2,0,NA,0,2,0,0,0,1,2,0,2,0,0,0,0,7,0,0,0,0,NA,1,0,NA,NA,NA,NA,0,0,NA,NA,NA,0,0,0,3,13,"tides",3,0,0.4286,NA,NA,NA
106,44844,NA,2018-09-15,"Frank Chen, Daniel Su",4,0.8,0,NA,NA,34.47146,-120.228,8,5,1,0,0,2,0,0,1,0,0,0,1,6,0,0,2,0,NA,0,0,0,0,0,1,0,0,0,0,0,0,0,0,0,0,0,0,NA,0,0,NA,NA,NA,NA,0,0,NA,NA,NA,0,0,0,0,4,"tides",4,0,0.2097,NA,NA,NA
107,44972,NA,2018-09-15,"Parasols in Paradise",1,1.37,0,NA,NA,34.45832,-120.02436,9,4,0,1,0,4,0,0,5,2,0,0,0,2,0,0,2,0,NA,0,0,0,0,4,0,1,0,0,0,0,0,0,0,0,2,0,0,NA,0,0,NA,NA,NA,NA,0,0,NA,NA,NA,0,0,0,0,0,"tides",1,0,0.0077,NA,NA,NA
108,54470,NA,2018-09-15,"Explore Ecology",40,46,0,NA,NA,34.968366899347,-120.64858312485,168,135,21,2,0,9,1,7,82,13,1,2,10,53,6,0,1,0,NA,0,11,1,0,11,24,1,0,1,3,10,0,0,21,2,0,7,4,NA,1,0,NA,NA,NA,NA,0,1,NA,NA,NA,1,15,0,9,28,"tides",40,0,5,NA,NA,NA
109,54473,NA,2018-09-15,"Explore Ecology",14,15.5,0,NA,NA,34.468087361408,-120.25485018676,55,46,4,1,0,4,0,2,16,6,0,1,0,30,1,0,1,0,NA,0,4,0,0,4,6,0,0,0,1,0,0,0,1,2,0,0,4,NA,0,0,NA,NA,NA,NA,0,0,NA,NA,NA,0,3,0,3,24,"tides",14,0,2,NA,NA,NA
110,54481,NA,2018-09-15,"Explore Ecology",18,23,0,NA,NA,34.464642558606,-120.10371039044,442,367,29,29,0,5,10,4,125,6,0,1,53,251,4,0,0,0,NA,0,4,1,0,35,13,9,2,10,18,1,0,3,32,1,0,2,3,NA,0,0,NA,NA,NA,NA,0,0,NA,NA,NA,1,25,0,25,200,"tides",18,0,3,NA,NA,NA
111,54485,NA,2018-09-15,"none",18,110,0,NA,NA,34.464642558606,-120.10371039044,430,338,5,67,0,12,4,11,219,35,1,4,72,84,11,0,4,0,NA,0,6,0,0,41,25,36,4,10,35,6,0,0,63,0,0,20,15,NA,0,0,NA,NA,NA,NA,0,1,NA,NA,NA,1,2,0,2,77,"tides",18,0,2,NA,NA,NA
112,54775,NA,2018-09-15,"Explore Ecology",16,456,0,NA,NA,34.470739629456,-120.17270588876,589,386,68,78,0,7,28,6,492,2,4,1,53,9,3,0,1,0,NA,0,23,9,0,131,159,45,22,40,9,20,0,17,39,1,0,1,0,NA,1,0,NA,NA,NA,NA,0,0,NA,NA,NA,2,0,0,9,0,"tides",16,0,1.5,NA,NA,NA
113,44118,NA,2018-09-15,"Family",3,0.78,0,NA,NA,35.37138,-120.86448,21,16,0,0,0,5,0,0,9,0,0,0,6,6,0,0,5,0,NA,0,0,0,0,2,0,0,0,0,2,0,0,1,4,0,0,0,0,NA,0,0,NA,NA,NA,NA,0,0,NA,NA,NA,0,0,0,0,1,"tides",3,0,0.0223,NA,NA,NA
114,44543,NA,2018-09-15,"Family",3,3.99,0,NA,NA,35.37141,-120.8644,94,68,0,0,0,25,0,0,38,2,1,0,23,29,0,0,2,0,NA,0,0,0,0,13,1,0,1,0,2,1,0,2,19,0,2,0,0,NA,1,0,NA,NA,NA,NA,0,0,NA,NA,NA,0,0,0,20,7,"tides",3,0,0,NA,NA,NA
115,50006,NA,2018-09-15,"Environmental Center of San Luis Obispo",38,295,0,NA,NA,35.454654217717,-120.95495363547,1460,1080,91,123,0,90,44,79,589,7,5,8,362,378,79,0,0,0,NA,0,41,22,0,73,137,89,32,33,14,24,0,12,149,3,0,0,4,NA,1,0,NA,NA,NA,NA,0,5,NA,NA,NA,0,43,0,0,330,"tides",36,2,4,13,NA,NA
116,50008,NA,2018-09-15,"Environmental Center of San Luis Obispo",53,131,0,NA,NA,35.415018652165,-120.8744841699,715,612,39,26,0,25,11,19,218,15,0,8,233,220,19,0,0,0,NA,0,26,3,0,48,22,8,2,12,15,13,0,2,69,1,0,2,12,NA,0,0,NA,NA,NA,NA,0,4,NA,NA,NA,4,24,0,14,182,"tides",41,12,2,7,NA,NA
117,50009,NA,2018-09-15,"Environmental Center of San Luis Obispo",45,454,0,NA,NA,35.368881281057,-120.85361561902,2268,1773,276,65,0,24,104,23,726,22,3,5,761,702,20,0,0,0,NA,0,64,67,0,106,82,26,26,55,34,45,0,7,245,0,0,0,22,NA,1,0,NA,NA,NA,NA,0,10,NA,NA,NA,3,249,0,41,407,"tides",39,6,3,36,NA,NA
118,50010,NA,2018-09-15,"Environmental Center of San Luis Obispo",34,72,0,NA,NA,35.280158964325,-120.88635224656,846,420,353,16,0,48,6,46,191,36,1,5,50,514,46,0,0,0,NA,0,14,0,0,20,19,7,3,7,6,2,0,0,119,2,0,11,23,NA,1,0,NA,NA,NA,NA,0,2,NA,NA,NA,3,341,0,23,147,"tides",27,7,4,4,NA,NA
119,50012,NA,2018-09-15,"Environmental Center of San Luis Obispo",39,779,0,NA,NA,35.176242226958,-120.7255853678,2584,1638,631,225,0,27,33,24,1018,5,29,0,801,677,24,0,0,0,NA,2,31,12,0,245,273,58,30,43,32,11,0,11,304,0,0,2,3,NA,25,0,NA,NA,NA,NA,0,5,NA,NA,NA,6,403,0,9,261,"tides",36,3,1,NA,NA,NA
120,50327,NA,2018-09-15,"Environmental Center of San Luis Obispo",61,94,0,NA,NA,35.367458882815,-120.85364658243,3027,2647,152,120,0,12,56,6,1028,36,11,3,1239,664,6,0,0,0,NA,0,36,23,0,217,67,30,40,41,83,43,0,10,482,0,0,25,11,NA,4,0,NA,NA,NA,NA,0,6,NA,NA,NA,1,127,0,90,443,"tides",51,10,4,NA,NA,NA
121,50328,NA,2018-09-15,"Environmental Center of San Luis Obispo",31,51,0,NA,NA,35.367458882815,-120.85364658243,1898,1776,53,36,0,15,9,11,257,22,4,2,1271,322,11,0,0,0,NA,0,17,4,0,39,39,14,9,8,26,10,0,3,98,2,0,7,13,NA,2,0,NA,NA,NA,NA,0,1,NA,NA,NA,0,35,0,24,262,"tides",21,10,1,NA,NA,NA
122,50329,NA,2018-09-15,"Environmental Center of San Luis Obispo",43,53,0,NA,NA,35.367458882815,-120.85364658243,2113,1926,29,91,0,7,34,3,738,37,5,8,736,560,1,0,0,0,NA,1,24,10,0,183,43,22,26,43,77,36,0,27,274,1,0,19,17,NA,0,0,NA,NA,NA,NA,0,16,NA,NA,NA,2,19,0,84,455,"tides",37,6,3,6,NA,NA
123,50330,NA,2018-09-15,"Environmental Center of San Luis Obispo",50,105,0,NA,NA,35.367458882815,-120.85364658243,864,553,111,177,0,16,3,7,570,5,0,11,142,125,7,0,0,0,NA,0,11,1,0,142,116,106,4,17,23,5,0,24,125,2,0,1,2,NA,0,0,NA,NA,NA,NA,0,0,NA,NA,NA,0,49,0,8,68,"tides",26,24,1,2,NA,NA
124,50331,NA,2018-09-15,"Environmental Center of San Luis Obispo",91,322,0,NA,NA,35.121904994151,-120.62979877353,2508,2146,108,125,0,32,57,13,1009,2,7,20,1090,327,11,0,0,0,NA,0,66,36,0,220,130,39,40,25,75,29,0,22,370,0,0,2,0,NA,4,0,NA,NA,NA,NA,0,12,NA,NA,NA,11,80,0,64,180,"tides",54,37,2,NA,NA,NA
125,50404,NA,2018-09-15,"Environmental Center of San Luis Obispo",3,5,0,NA,NA,35.178421124175,-120.72307348904,98,95,1,2,0,0,0,0,43,0,0,0,27,28,0,0,0,0,NA,0,1,0,0,4,4,1,0,0,5,0,0,2,26,0,0,0,0,NA,0,0,NA,NA,NA,NA,0,0,NA,NA,NA,0,0,0,1,27,"tides",3,0,3,1,NA,NA
126,50405,NA,2018-09-15,"Environmental Center of San Luis Obispo",13,13,0,NA,NA,35.178421124175,-120.72307348904,67,51,7,8,0,0,0,0,37,1,0,0,15,13,0,0,0,0,NA,0,0,0,0,5,12,5,1,4,3,0,0,0,8,0,0,1,0,NA,0,0,NA,NA,NA,NA,0,0,NA,NA,NA,0,0,0,0,13,"tides",12,1,0.5,NA,NA,NA
127,50407,NA,2018-09-15,"Environmental Center of San Luis Obispo",57,15,0,NA,NA,35.178421124175,-120.72307348904,478,415,12,21,0,6,13,5,224,9,1,0,172,56,5,0,0,0,NA,13,16,7,0,41,11,7,11,9,24,7,0,5,84,0,0,2,7,NA,0,0,NA,NA,NA,NA,0,3,NA,NA,NA,0,8,0,3,45,"tides",28,29,2,2,NA,NA
128,50408,NA,2018-09-15,"Environmental Center of San Luis Obispo",28,27,0,NA,NA,35.178421124175,-120.72307348904,510,394,20,51,0,26,17,10,237,18,14,0,85,144,8,0,0,0,NA,11,31,5,0,37,29,26,2,15,4,5,0,8,67,4,0,14,0,NA,0,0,NA,NA,NA,NA,0,8,NA,NA,NA,1,10,0,10,123,"tides",9,19,2,NA,NA,NA
129,50409,NA,2018-09-15,"Environmental Center of San Luis Obispo",27,148,0,NA,NA,35.178421124175,-120.72307348904,3214,2777,186,75,0,30,129,23,1147,0,0,17,1294,716,23,0,0,0,NA,2,51,121,0,163,96,15,17,24,77,0,0,22,577,0,0,0,0,NA,0,0,NA,NA,NA,NA,0,3,NA,NA,NA,0,147,0,69,499,"tides",20,7,1,8,NA,NA
130,50410,NA,2018-09-15,"Environmental Center of San Luis Obispo",40,352,0,NA,NA,35.178421124175,-120.72307348904,909,596,156,58,0,0,57,1,448,50,0,0,98,270,0,0,0,0,NA,0,59,12,0,73,86,40,42,73,39,24,0,2,40,0,0,50,0,NA,0,0,NA,NA,NA,NA,0,0,NA,NA,NA,0,120,0,24,126,"tides",30,10,1,27,NA,NA
131,50411,NA,2018-09-15,"Environmental Center of San Luis Obispo",82,30,0,NA,NA,35.178421124175,-120.72307348904,1047,969,0,62,0,0,0,0,587,0,0,0,444,0,0,0,0,0,NA,0,0,0,0,162,0,0,16,0,85,24,0,12,304,0,0,0,0,NA,0,0,NA,NA,NA,NA,0,0,NA,NA,NA,0,0,0,0,0,"tides",62,20,0.5,NA,NA,NA
132,50413,NA,2018-09-15,"Environmental Center of San Luis Obispo",52,147,0,NA,NA,35.442131554227,-120.89493209568,1274,1134,61,47,0,6,25,6,421,6,0,10,438,392,5,0,1,0,NA,1,27,23,0,92,15,7,1,8,42,16,0,16,174,0,0,5,1,NA,0,0,NA,NA,NA,NA,0,2,NA,NA,NA,1,48,0,10,334,"tides",45,7,2,NA,NA,NA
133,50414,NA,2018-09-15,"Environmental Center of San Luis Obispo",23,40,0,NA,NA,35.43500102486,-120.88828820445,535,491,5,16,0,3,11,0,160,12,0,9,186,159,0,0,0,0,NA,1,16,2,0,45,7,4,9,10,8,2,0,4,63,0,0,6,6,NA,0,0,NA,NA,NA,NA,0,4,NA,NA,NA,2,5,0,6,146,"tides",20,3,1,NA,NA,NA
134,50425,NA,2018-09-15,"Environmental Center of San Luis Obispo",19,32,0,NA,NA,35.366052291462,-120.85140779614,115,94,12,2,0,4,3,2,44,13,0,0,11,45,2,0,0,0,NA,0,7,1,0,5,9,2,0,2,1,5,0,0,12,2,0,10,1,NA,0,0,NA,NA,NA,NA,0,0,NA,NA,NA,1,9,0,9,27,"tides",18,1,4,4,NA,NA
135,50426,NA,2018-09-15,"Environmental Center of San Luis Obispo",11,11,0,NA,NA,35.370396495697,-120.85591891971,1355,1292,24,27,0,1,6,1,211,6,0,3,900,229,1,0,0,0,NA,0,5,0,0,27,13,14,5,12,38,9,0,2,93,0,0,0,6,NA,0,0,NA,NA,NA,NA,0,9,NA,NA,NA,0,22,0,3,202,"tides",8,3,3,3,NA,NA
136,50428,NA,2018-09-15,"Environmental Center of San Luis Obispo",63,453,0,NA,NA,35.100258492747,-120.61886829568,1804,1267,278,118,0,64,58,37,801,25,3,31,283,605,34,0,0,0,NA,0,51,25,0,167,153,57,19,50,43,25,0,28,208,0,0,3,22,NA,0,0,NA,NA,NA,NA,0,5,NA,NA,NA,2,202,0,33,364,"tides",53,10,7,26,NA,NA
137,56248,NA,2018-09-15,"Morro Rocky Parking Lot",3,45,0,NA,NA,35.36465918598,-120.85257369883,119,105,4,1,0,5,3,5,18,1,0,0,66,28,5,0,0,0,NA,0,0,0,0,3,1,0,1,4,10,0,0,0,0,0,0,0,1,NA,0,0,NA,NA,NA,NA,0,1,NA,NA,NA,0,3,0,2,23,"tides",3,0,0.25,2,NA,NA
138,56249,NA,2018-09-15,"Morro Rock- Parking Lot and beach",4,60,0,NA,NA,35.36465918598,-120.85257369883,89,83,3,1,0,2,0,0,22,2,1,0,35,29,0,0,0,0,NA,0,4,0,0,7,2,0,0,1,1,0,0,0,7,1,0,1,0,NA,0,0,NA,NA,NA,NA,0,1,NA,NA,NA,0,2,0,25,2,"tides",4,0,0.25,4,NA,NA
139,56250,NA,2018-09-15,"Morro Bay Parking Lot",3,45,0,NA,NA,35.36465918598,-120.85257369883,63,59,1,1,0,0,2,0,8,0,0,0,43,12,0,0,0,0,NA,0,1,1,0,1,0,0,0,2,0,0,0,0,3,0,0,0,0,NA,0,0,NA,NA,NA,NA,0,0,NA,NA,NA,0,1,0,8,3,"tides",3,0,0.25,2,NA,NA
140,56251,NA,2018-09-15,"Morro Bay Beach",1,7,0,NA,NA,35.36465918598,-120.85257369883,39,34,1,2,0,0,1,0,14,1,0,0,20,3,0,0,0,0,NA,0,0,0,0,3,0,1,1,1,1,0,0,1,7,0,0,0,1,NA,0,0,NA,NA,NA,NA,0,0,NA,NA,NA,1,1,0,1,1,"tides",1,0,0.25,1,NA,NA
141,56252,NA,2018-09-15,"Morro Bay",3,21,0,NA,NA,35.36465918598,-120.85257369883,83,77,1,1,0,1,1,0,30,1,0,1,34,15,0,0,0,0,NA,0,1,1,0,2,0,0,2,0,2,0,0,0,24,1,0,0,0,NA,0,0,NA,NA,NA,NA,0,1,NA,NA,NA,1,1,0,9,5,"tides",3,0,0.25,1,NA,NA
142,56253,NA,2018-09-15,"Morro Rock",3,21,0,NA,NA,35.36465918598,-120.85257369883,53,49,1,3,0,0,0,0,5,1,0,0,26,21,0,0,0,0,NA,0,0,0,0,3,1,0,0,0,1,0,0,0,0,0,0,1,0,NA,0,0,NA,NA,NA,NA,0,0,NA,NA,NA,0,0,0,0,21,"tides",3,0,0.25,1,NA,NA
143,56254,NA,2018-09-15,"Morro Rock Area/ Parking Lot and Beach",2,14,0,NA,NA,35.36465918598,-120.85257369883,107,84,1,3,0,8,9,4,20,5,0,0,45,31,4,0,0,0,NA,0,1,1,0,1,0,2,2,8,1,0,0,0,6,4,0,1,0,NA,0,0,NA,NA,NA,NA,0,0,NA,NA,NA,0,1,0,0,30,"tides",2,0,0.25,1,NA,NA
144,56255,NA,2018-09-15,"Morro Bay",2,14,0,NA,NA,35.36465918598,-120.85257369883,162,148,5,5,0,2,2,2,26,1,0,0,80,53,2,0,0,0,NA,0,4,0,0,4,5,2,0,3,2,5,0,0,1,0,0,1,0,NA,0,0,NA,NA,NA,NA,0,0,NA,NA,NA,0,5,0,28,20,"tides",2,0,0.25,1,NA,NA
145,56256,NA,2018-09-15,"Morro Rock Parking Lot",2,14,0,NA,NA,35.36465918598,-120.85257369883,72,63,4,1,0,0,4,0,11,1,0,0,47,13,0,0,0,0,NA,0,0,0,0,0,0,1,0,4,0,0,0,0,6,0,0,0,1,NA,0,0,NA,NA,NA,NA,0,0,NA,NA,NA,0,4,0,0,9,"tides",2,0,0.25,1,NA,NA
146,56257,NA,2018-09-15,"Morro Rock Parking Lot",4,60,0,NA,NA,35.36465918598,-120.85257369883,140,129,2,5,0,3,1,1,23,0,1,2,50,63,1,0,0,0,NA,0,2,0,0,7,2,0,0,1,0,0,0,1,10,0,0,0,0,NA,1,0,NA,NA,NA,NA,0,0,NA,NA,NA,1,2,0,3,58,"tides",4,0,0.25,4,NA,NA
147,56258,NA,2018-09-15,"Morro Bay",2,14,0,NA,NA,35.36465918598,-120.85257369883,116,108,0,2,0,0,3,0,48,3,0,1,55,6,0,0,0,0,NA,0,0,0,0,6,1,0,3,4,8,5,0,1,23,0,0,2,1,NA,0,0,NA,NA,NA,NA,0,0,NA,NA,NA,0,0,0,3,3,"tides",2,0,0.25,1,NA,NA
148,56259,NA,2018-09-15,"Morro Bay",4,28,0,NA,NA,35.36465918598,-120.85257369883,148,113,15,4,0,1,15,1,63,2,0,0,49,33,1,0,0,0,NA,0,1,15,0,7,3,1,0,4,3,3,0,1,25,0,0,0,2,NA,0,0,NA,NA,NA,NA,0,2,NA,NA,NA,0,13,0,5,15,"tides",4,0,0.25,2,NA,NA
149,56260,NA,2018-09-15,"Morro Bay",3,21,0,NA,NA,35.36465918598,-120.85257369883,216,190,8,7,0,2,9,1,88,1,1,0,122,3,1,0,0,0,NA,0,2,1,0,13,30,1,0,8,4,11,0,0,20,0,0,0,1,NA,0,0,NA,NA,NA,NA,0,3,NA,NA,NA,0,0,0,1,0,"tides",3,0,0.25,1,NA,NA
150,56261,NA,2018-09-15,"Morro Bay",5,35,0,NA,NA,35.36465918598,-120.85257369883,89,85,1,1,0,0,2,0,40,2,0,0,25,22,0,0,0,0,NA,0,2,2,0,2,1,1,0,2,0,1,0,0,29,0,0,2,0,NA,0,0,NA,NA,NA,NA,0,0,NA,NA,NA,0,0,0,9,13,"tides",5,0,0.25,2,NA,NA
151,56262,NA,2018-09-15,"Morro Bay",3,21,0,NA,NA,35.36465918598,-120.85257369883,175,167,4,0,0,3,1,3,17,0,0,0,108,47,3,0,0,0,NA,0,2,1,0,2,3,0,0,1,2,0,0,0,6,0,0,0,0,NA,0,0,NA,NA,NA,NA,0,7,NA,NA,NA,1,4,0,9,34,"tides",3,0,0.25,1,NA,NA
152,56263,NA,2018-09-15,"Morro Bay",3,21,0,NA,NA,35.36465918598,-120.85257369883,191,188,1,1,0,0,1,0,27,5,1,0,116,42,0,0,0,0,NA,0,0,1,0,3,0,0,0,0,2,0,0,1,20,0,0,0,5,NA,1,0,NA,NA,NA,NA,0,0,NA,NA,NA,0,1,0,3,38,"tides",3,0,0.25,1,NA,NA
153,52390,NA,2018-09-18,"Keep By The Sea",46,3.5,0,NA,NA,35.123440595543,-120.63351428047,157,152,1,1,0,3,0,0,20,0,0,3,82,52,0,0,0,0,NA,0,0,0,0,8,1,1,0,0,0,0,0,0,10,0,0,0,0,NA,0,0,NA,NA,NA,NA,0,0,NA,NA,NA,0,0,0,0,52,"tides",8,38,0.25,NA,NA,NA
154,52392,NA,2018-09-19,"Keep By The Sea",21,24,0,NA,NA,35.123440595543,-120.63351428047,38,33,5,0,0,0,0,0,12,0,0,0,23,3,0,0,0,0,NA,0,0,0,0,0,3,0,0,0,0,0,0,0,9,0,0,0,0,NA,0,0,NA,NA,NA,NA,0,0,NA,NA,NA,0,2,0,0,1,"tides",4,17,0.25,NA,NA,NA
155,52393,NA,2018-09-19,"Keep By The Sea",20,6,0,NA,NA,35.123440595543,-120.63351428047,201,186,2,10,0,0,0,0,71,0,0,0,107,20,0,0,0,0,NA,0,4,0,0,0,4,10,3,6,0,0,0,0,47,0,0,0,0,NA,0,0,NA,NA,NA,NA,0,0,NA,NA,NA,0,0,0,0,20,"tides",3,17,0.25,NA,NA,NA
156,52394,NA,2018-09-20,"Keep By The Sea",19,3,0,NA,NA,35.123440595543,-120.63351428047,49,41,6,2,0,0,0,0,26,0,0,1,5,17,0,0,1,0,NA,0,3,0,0,8,2,0,0,0,1,6,0,1,5,0,0,0,0,NA,0,0,NA,NA,NA,NA,0,0,NA,NA,NA,1,4,0,0,13,"tides",3,16,0.25,NA,NA,NA
157,50352,NA,2018-09-25,"Keep By The Sea",19,11,0,NA,NA,35.123150361844,-120.63361306489,212,201,6,2,0,1,0,0,58,0,1,1,104,46,0,0,1,0,NA,0,0,0,0,5,7,1,2,2,0,0,0,1,42,0,0,0,0,NA,0,0,NA,NA,NA,NA,0,1,NA,NA,NA,0,2,0,0,44,"tides",3,16,0.25,NA,NA,NA
158,52378,NA,2018-09-27,"Keep By The Sea",20,7,0,NA,NA,35.123440595543,-120.63351428047,169,142,9,9,0,2,5,2,74,2,0,0,50,39,2,0,0,0,NA,0,9,3,0,12,3,3,2,4,2,0,0,3,35,0,0,2,0,NA,0,0,NA,NA,NA,NA,0,0,NA,NA,NA,0,8,0,0,31,"tides",3,17,0.25,NA,NA,NA
159,52384,NA,2018-10-02,"Keep By The Sea",41,9,0,NA,NA,35.123440595543,-120.63351428047,306,265,27,5,0,2,7,2,85,0,0,36,110,73,2,0,0,0,NA,0,5,4,0,16,10,1,0,4,1,1,0,7,36,0,0,0,0,NA,0,0,NA,NA,NA,NA,0,0,NA,NA,NA,0,23,0,0,50,"tides",6,35,0.25,NA,NA,NA
160,52389,NA,2018-10-03,"Keep By The Sea",21,10,0,NA,NA,35.123440595543,-120.63351428047,254,241,0,7,0,0,0,0,155,0,0,0,73,20,0,0,0,0,NA,0,0,0,0,25,0,2,6,2,7,0,0,4,115,0,0,0,0,NA,0,0,NA,NA,NA,NA,0,0,NA,NA,NA,0,0,0,0,20,"tides",3,18,0.25,NA,NA,NA
161,52386,NA,2018-10-04,"Keep By The Sea",23,55,0,NA,NA,35.123440595543,-120.63351428047,360,346,9,4,0,0,0,0,102,0,0,0,184,73,0,0,0,0,NA,0,0,0,0,15,0,2,1,1,12,7,0,5,60,0,0,0,0,NA,0,0,NA,NA,NA,NA,0,0,NA,NA,NA,0,9,0,0,64,"tides",4,19,0.25,NA,NA,NA
162,52387,NA,2018-10-04,"Keep By The Sea",21,4.6,0,NA,NA,35.123440595543,-120.63351428047,98,93,0,5,0,0,0,0,34,0,0,0,61,3,0,0,0,0,NA,0,4,0,0,7,0,1,0,1,0,0,0,0,21,0,0,0,0,NA,0,0,NA,NA,NA,NA,0,0,NA,NA,NA,0,0,0,0,3,"tides",3,18,0.25,NA,NA,NA
163,51544,NA,2018-10-06,"Environmental Center of San Luis Obispo",28,35,0,NA,NA,35.179691907139,-120.73359312947,2073,1891,48,88,0,26,11,17,677,12,8,38,679,633,17,0,0,0,NA,1,16,3,0,192,13,11,9,18,80,5,0,22,316,0,0,5,7,NA,0,0,NA,NA,NA,NA,0,3,NA,NA,NA,0,41,0,35,557,"tides",28,0,1,9,NA,NA
164,51546,NA,2018-10-06,"Environmental Center of San Luis Obispo",16,67,0,NA,NA,35.053676395509,-120.62997691732,1450,1013,207,99,0,113,11,47,439,14,1,80,302,560,46,0,8,0,NA,0,31,6,0,166,25,25,7,23,24,9,0,13,117,0,0,3,11,NA,0,0,NA,NA,NA,NA,0,1,NA,NA,NA,4,197,0,48,315,"tides",15,1,1,9,NA,NA
165,51712,NA,2018-10-11,"Keep By The Sea",18,3.01,0,NA,NA,35.123292571504,-120.63357689561,129,101,1,0,0,24,3,20,21,0,0,4,59,25,20,0,0,0,NA,0,2,0,0,6,2,0,0,4,1,0,0,0,6,0,0,0,0,NA,0,0,NA,NA,NA,NA,0,2,NA,NA,NA,1,1,0,0,24,"tides",3,15,0.25,NA,NA,NA
166,51713,NA,2018-10-11,"Keep By The Sea",19,7,0,NA,NA,35.123292571504,-120.63357689561,143,114,6,8,0,0,13,0,80,0,1,0,55,5,0,0,0,0,NA,0,5,0,0,11,8,3,2,19,2,15,0,2,15,0,0,0,0,NA,1,0,NA,NA,NA,NA,0,0,NA,NA,NA,0,0,0,0,5,"tides",3,16,0.25,NA,NA,NA
167,52356,NA,2018-10-16,"Keep By The Sea",19,8,0,NA,NA,35.123323742013,-120.6335499909,166,138,9,13,0,0,5,0,74,7,0,4,54,26,0,0,4,0,NA,0,14,4,0,14,8,6,1,3,3,0,0,1,21,0,0,0,7,NA,0,0,NA,NA,NA,NA,0,0,NA,NA,NA,1,3,0,0,23,"tides",3,16,0.25,NA,NA,NA
168,52358,NA,2018-10-16,"Keep By The Sea",20,9,0,NA,NA,35.123317804844,-120.63351159826,218,196,2,19,0,0,1,0,37,0,0,19,98,64,0,0,2,0,NA,0,8,1,0,1,0,19,0,0,0,0,0,0,8,0,0,0,0,NA,0,0,NA,NA,NA,NA,0,0,NA,NA,NA,0,2,0,0,62,"tides",16,4,0.25,NA,NA,NA
169,52360,NA,2018-10-17,"Keep By The Sea",19,54,0,NA,NA,35.123317804844,-120.63351159826,487,466,9,7,0,0,5,0,160,0,0,1,276,50,0,0,1,0,NA,0,12,3,0,10,13,3,0,10,8,0,0,2,99,0,0,0,0,NA,0,0,NA,NA,NA,NA,0,0,NA,NA,NA,0,3,0,0,47,"tides",3,16,0.25,NA,NA,NA
170,52359,NA,2018-10-18,"Keep By The Sea",20,3.05,0,NA,NA,35.123317804844,-120.63351159826,81,70,3,5,0,3,0,1,13,4,0,3,30,30,1,0,0,0,NA,0,0,0,0,8,0,1,0,0,0,0,0,0,4,0,0,0,4,NA,0,0,NA,NA,NA,NA,0,0,NA,NA,NA,0,3,0,0,27,"tides",4,16,0.25,NA,NA,NA
171,52361,NA,2018-10-18,"Keep By The Sea",19,5.55,0,NA,NA,35.123317804844,-120.63351159826,211,189,11,10,0,1,0,0,118,0,1,1,46,45,0,0,0,0,NA,0,8,0,0,10,8,2,0,8,4,2,0,2,74,0,0,0,0,NA,1,0,NA,NA,NA,NA,0,0,NA,NA,NA,2,5,0,0,40,"tides",3,16,0.25,NA,NA,NA
172,56660,NA,2018-10-25,"Keep By The Sea",41,21.2,0,NA,NA,35.123364366719,-120.63364416403,394,327,18,8,0,3,4,3,142,4,0,43,114,54,3,0,5,0,NA,0,8,1,0,20,9,0,34,9,0,62,0,0,33,0,0,1,3,NA,0,0,NA,NA,NA,NA,0,0,NA,NA,NA,0,17,0,0,37,"tides",7,34,0.25,NA,NA,NA
173,73669,NA,2018-10-25,"Keep By The Sea",20,5,0,NA,NA,35.123826906769,-120.6335518314,120,95,15,4,0,1,3,0,32,1,0,6,38,41,0,0,6,0,NA,0,1,1,0,6,1,0,2,2,3,8,0,0,10,1,0,0,0,NA,0,0,NA,NA,NA,NA,0,0,NA,NA,NA,1,15,0,0,26,"tides",3,17,0.25,NA,NA,NA
174,73670,NA,2018-10-25,"Keep By The Sea",21,16.2,0,NA,NA,35.123756704915,-120.63346600071,233,211,3,14,0,2,0,2,135,1,0,0,77,15,2,0,0,0,NA,0,0,0,0,24,0,0,3,0,31,57,0,0,23,0,0,1,0,NA,0,0,NA,NA,NA,NA,0,0,NA,NA,NA,0,3,0,0,12,"tides",17,4,0.25,NA,NA,NA
175,54248,NA,2018-10-29,"Natural Reserve System California Ecology and Conservation",5,1.1,0,NA,NA,35.273810198126,-120.88870500926,21,21,0,0,0,0,0,0,10,0,1,0,10,0,0,0,0,0,NA,0,0,0,0,4,1,0,0,0,0,0,0,0,5,0,0,0,0,NA,1,0,NA,NA,NA,NA,0,0,NA,NA,NA,0,0,0,0,0,"tides",5,0,0.12,1,NA,NA
176,54249,NA,2018-10-29,"Natural Reserve System California Ecology and Conservation",5,1.76,0,NA,NA,35.387627785799,-120.86499624761,24,14,0,0,0,10,0,0,3,0,0,10,11,0,0,0,0,0,NA,0,0,0,0,0,1,0,0,0,0,0,0,0,2,0,0,0,0,NA,0,0,NA,NA,NA,NA,0,0,NA,NA,NA,0,0,0,0,0,"tides",5,0,0.19,1,NA,NA
177,54250,NA,2018-10-29,"Natural Reserve System California Ecology and Conservation",5,1.1,0,NA,NA,35.44802195969,-120.90508116852,22,22,0,0,0,0,0,0,7,0,0,0,15,0,0,0,0,0,NA,0,0,0,0,4,0,0,0,0,0,2,0,1,0,0,0,0,0,NA,0,0,NA,NA,NA,NA,0,0,NA,NA,NA,0,0,0,0,0,"tides",5,0,0.19,1,NA,NA
178,54254,NA,2018-10-29,"Natural Reserve System California Ecology and Conservation",5,1.1,0,NA,NA,35.553482125403,-121.0999751353,5,5,0,0,0,0,0,0,1,2,0,0,2,0,0,0,0,0,NA,0,0,0,0,1,0,0,0,0,0,0,0,0,0,0,0,0,2,NA,0,0,NA,NA,NA,NA,0,0,NA,NA,NA,0,0,0,0,0,"tides",5,0,0.12,1,NA,NA
179,73671,NA,2018-11-01,"Keep By The Sea",21,5,0,NA,NA,35.123523179764,-120.63346861676,160,99,0,5,0,51,1,51,50,0,0,2,20,33,51,0,2,0,NA,0,9,0,0,4,0,1,4,1,1,5,0,0,29,0,0,0,0,NA,0,0,NA,NA,NA,NA,0,0,NA,NA,NA,0,0,0,0,33,"tides",3,18,0.25,NA,NA,NA
180,73666,NA,2018-11-06,"Keep By The Sea",6,2.5,0,NA,NA,35.12348447102,-120.63350212438,47,33,7,5,0,0,2,0,20,0,0,0,9,18,0,0,0,0,NA,0,2,1,0,3,3,4,0,1,0,1,0,0,5,0,0,0,0,NA,0,0,NA,NA,NA,NA,0,0,NA,NA,NA,1,6,0,0,12,"tides",1,5,0.25,NA,NA,NA
181,73673,NA,2018-11-06,"Keep By The Sea",16,3.7,0,NA,NA,35.123897108562,-120.63329433933,128,111,9,6,0,0,0,0,39,0,0,0,57,30,0,0,0,0,NA,0,0,0,0,9,0,0,2,0,0,0,0,2,28,0,0,0,0,NA,0,0,NA,NA,NA,NA,0,0,NA,NA,NA,0,9,0,0,21,"tides",2,14,0.25,NA,NA,NA
182,73674,NA,2018-11-06,"Keep By The Sea",17,3.52,0,NA,NA,35.123612565323,-120.63334902237,83,79,0,2,0,0,0,0,22,1,0,1,54,3,0,0,0,0,NA,0,3,0,0,5,0,2,2,0,2,1,0,0,9,0,0,0,1,NA,0,0,NA,NA,NA,NA,0,0,NA,NA,NA,0,0,0,0,3,"tides",3,14,0.25,NA,NA,NA
183,74173,NA,2018-11-08,"none",17,6.85,0,NA,NA,35.123490194277,-120.63347228462,98,85,2,7,0,0,3,0,35,0,0,9,24,29,0,0,9,0,NA,0,7,0,0,6,4,2,1,6,3,4,0,1,2,0,0,0,0,NA,0,0,NA,NA,NA,NA,0,0,NA,NA,NA,2,0,0,0,29,"tides",3,14,0.25,NA,NA,NA
184,74174,NA,2018-11-08,"Keep By The Sea",17,2,0,NA,NA,35.123490194277,-120.63347228462,405,386,6,12,0,0,1,0,86,0,0,0,274,45,0,0,0,0,NA,0,0,1,0,26,1,2,0,0,8,0,0,1,47,0,0,0,0,NA,0,0,NA,NA,NA,NA,0,0,NA,NA,NA,0,6,0,0,39,"tides",3,14,0.25,NA,NA,NA
185,67682,NA,2018-11-14,"Keep By the Sea",20,2,0,NA,NA,35.123009682346,-120.63359402323,133,109,17,1,0,5,0,5,33,1,0,3,54,36,5,0,2,0,NA,0,5,0,0,5,1,0,1,0,0,4,0,1,17,0,0,1,0,NA,0,0,NA,NA,NA,NA,0,0,NA,NA,NA,1,17,0,0,19,"tides",3,17,0.25,NA,NA,NA
186,74215,NA,2018-11-14,"Keep By The Sea",6,3.1,0,NA,NA,35.123418243437,-120.63350891605,26,26,0,0,0,0,0,0,2,0,0,0,24,0,0,0,0,0,NA,0,0,0,0,1,0,0,0,0,0,0,0,1,0,0,0,0,0,NA,0,0,NA,NA,NA,NA,0,0,NA,NA,NA,0,0,0,0,0,"tides",1,5,0.25,NA,NA,NA
187,74217,NA,2018-11-14,"Keep By The Sea",6,3.5,0,NA,NA,35.123418243437,-120.63350891605,47,29,0,5,0,0,11,0,35,0,0,0,10,0,0,0,0,0,NA,0,6,10,0,2,4,3,2,3,1,1,0,1,4,0,0,0,0,NA,0,0,NA,NA,NA,NA,0,0,NA,NA,NA,0,0,0,0,0,"tides",1,5,0.25,NA,NA,NA
188,74218,NA,2018-11-14,"Keep By The Sea",12,3.18,0,NA,NA,35.123418243437,-120.63350891605,116,93,0,6,0,0,17,0,63,0,0,0,13,40,0,0,0,0,NA,0,6,16,0,8,0,2,0,1,1,4,0,4,21,0,0,0,0,NA,0,0,NA,NA,NA,NA,0,0,NA,NA,NA,1,0,0,0,40,"tides",3,9,0.25,NA,NA,NA
189,74220,NA,2018-11-14,"Keep By The Sea",14,2.7,0,NA,NA,35.123418243437,-120.63350891605,121,111,0,2,0,1,1,1,39,0,0,0,72,3,1,0,0,0,NA,0,0,0,0,7,2,1,6,1,2,0,0,0,26,0,0,0,0,NA,0,0,NA,NA,NA,NA,0,0,NA,NA,NA,0,0,0,0,3,"tides",2,12,0.25,NA,NA,NA
190,56166,NA,2018-11-15,"Environmental Center of San Luis Obispo",10,6,0,NA,NA,35.365779076366,-120.85072833903,531,503,1,9,0,1,13,0,119,3,1,2,329,73,0,0,0,0,NA,0,9,0,0,21,6,0,4,14,6,4,0,0,59,0,0,0,3,NA,1,0,NA,NA,NA,NA,0,0,NA,NA,NA,0,0,0,20,53,"tides",7,3,1,2,NA,NA
191,74175,NA,2018-11-15,"Keep By The Sea",18,4.5,0,NA,NA,35.123490194277,-120.63347228462,225,207,4,4,0,0,9,0,49,0,0,0,97,78,0,0,0,0,NA,0,3,0,0,8,2,0,1,11,3,5,0,2,15,0,0,0,0,NA,0,0,NA,NA,NA,NA,0,0,NA,NA,NA,0,4,0,0,74,"tides",3,15,0.25,NA,NA,NA
192,74216,NA,2018-11-15,"Keep By The Sea",7,3.7,0,NA,NA,35.123418243437,-120.63350891605,149,143,1,0,0,0,0,0,29,0,0,0,95,20,0,0,0,0,NA,0,1,0,0,4,3,0,5,4,6,5,0,0,6,0,0,0,0,NA,0,0,NA,NA,NA,NA,0,0,NA,NA,NA,0,0,0,0,20,"tides",1,6,0.25,NA,NA,NA
193,56167,NA,2018-11-17,"Environmental Center of San Luis Obispo",34,78,0,NA,NA,35.419423776202,-120.87441078518,1021,540,223,52,0,182,10,155,283,4,2,29,112,422,155,0,0,0,NA,0,33,9,0,53,52,21,14,5,5,5,0,1,105,1,0,0,3,NA,1,0,NA,NA,NA,NA,0,2,NA,NA,NA,1,209,0,9,198,"tides",24,10,2,7,NA,NA
194,56128,NA,2018-11-25,"none",2,1.05,0,NA,NA,35.37119,-120.86498,30,26,1,2,0,1,0,0,9,0,0,0,15,6,0,0,1,0,NA,0,0,0,0,0,2,2,0,1,0,1,0,0,3,0,0,0,0,NA,0,0,NA,NA,NA,NA,0,0,NA,NA,NA,0,0,0,0,5,"tides",2,0,0.7159,NA,NA,NA
195,56416,NA,2018-11-27,"Keep By The Sea",20,19,0,NA,NA,35.122936723668,-120.63368556327,802,742,4,20,0,8,2,8,230,0,0,5,260,273,8,0,5,0,NA,0,14,0,0,24,11,7,26,8,22,1,0,6,137,0,0,0,0,NA,0,0,NA,NA,NA,NA,0,0,NA,NA,NA,1,0,0,0,273,"tides",4,16,0.25,NA,NA,NA
196,74224,NA,2018-12-04,"Keep By The Sea",40,11.8,0,NA,NA,35.123418243437,-120.63350891605,495,440,22,14,0,0,4,0,150,1,0,0,102,227,0,0,0,0,NA,0,16,1,0,40,14,2,15,9,4,4,0,1,59,0,0,0,1,NA,0,0,NA,NA,NA,NA,0,0,NA,NA,NA,0,12,0,0,215,"tides",7,33,0.25,NA,NA,NA
197,74221,NA,2018-12-05,"Keep By The Sea",17,7,0,NA,NA,35.123418243437,-120.63350891605,184,164,4,4,0,0,7,0,85,0,0,4,37,53,0,0,4,0,NA,0,6,3,0,24,2,0,5,9,4,10,0,3,24,0,0,0,0,NA,0,0,NA,NA,NA,NA,0,0,NA,NA,NA,2,4,0,0,49,"tides",3,14,0.25,NA,NA,NA
198,74222,NA,2018-12-05,"Keep By The Sea",23,8.1,0,NA,NA,35.123418243437,-120.63350891605,311,272,15,20,0,0,1,0,132,0,0,5,133,38,0,0,5,0,NA,0,3,1,0,38,13,4,3,6,10,4,0,1,52,0,0,0,0,NA,0,0,NA,NA,NA,NA,0,0,NA,NA,NA,0,4,0,0,34,"tides",4,19,0.25,NA,NA,NA
199,74226,NA,2018-12-06,"Keep By The Sea",24,19.2,0,NA,NA,35.123418243437,-120.63350891605,368,344,6,11,0,0,3,0,96,0,0,3,209,56,0,0,3,0,NA,0,2,0,0,29,2,1,4,4,1,5,0,3,49,0,0,0,0,NA,0,0,NA,NA,NA,NA,0,0,NA,NA,NA,1,5,0,0,51,"tides",4,20,0.25,NA,NA,NA
200,58918,NA,2018-12-09,"Keep By The Sea",20,5.5,0,NA,NA,35.123115277998,-120.63366370079,105,105,0,0,0,0,0,0,23,0,0,0,82,0,0,0,0,0,NA,0,0,0,0,0,0,0,0,0,0,0,0,0,23,0,0,0,0,NA,0,0,NA,NA,NA,NA,0,0,NA,NA,NA,0,0,0,0,0,"tides",4,16,0.25,NA,NA,NA
201,74232,NA,2018-12-11,"Keep By The Sea",20,3.18,0,NA,NA,35.123418243437,-120.63350891605,103,85,4,4,0,0,7,0,53,0,0,1,31,15,0,0,1,0,NA,0,10,4,0,4,1,3,3,3,0,0,0,0,28,0,0,0,0,NA,0,0,NA,NA,NA,NA,0,0,NA,NA,NA,0,3,0,0,12,"tides",3,17,0.25,NA,NA,NA
202,74230,NA,2018-12-12,"Keep By The Sea",19,9.5,0,NA,NA,35.123418243437,-120.63350891605,469,454,5,7,0,0,0,0,88,0,0,0,341,37,0,0,0,0,NA,0,0,0,0,23,4,4,3,0,0,2,0,1,54,0,0,0,0,NA,0,0,NA,NA,NA,NA,0,0,NA,NA,NA,1,5,0,0,32,"tides",4,15,0.25,NA,NA,NA
203,57685,NA,2018-12-17,"none",1,0.56,0,NA,NA,35.41346,-120.8742,8,8,0,0,0,0,0,0,0,0,0,1,3,4,0,0,1,0,NA,0,0,0,0,0,0,0,0,0,0,0,0,0,0,0,0,0,0,NA,0,0,NA,NA,NA,NA,0,0,NA,NA,NA,0,0,0,0,4,"tides",1,0,0.1146,NA,NA,NA
204,57687,NA,2018-12-17,"none",1,1.72,0,NA,NA,35.42179,-120.87741,18,16,0,0,0,2,0,0,0,2,0,1,2,13,0,0,1,0,NA,0,0,0,0,0,0,0,0,0,0,0,0,0,0,0,2,0,0,NA,0,0,NA,NA,NA,NA,0,0,NA,NA,NA,0,0,0,0,13,"tides",1,0,0,NA,NA,NA
205,58920,NA,2018-12-18,"Keep By The Sea",18,7.86,0,NA,NA,35.123115277998,-120.63366370079,148,140,5,1,0,2,0,2,65,0,1,1,52,27,2,0,0,0,NA,0,0,0,0,28,0,0,0,0,6,5,0,1,25,0,0,0,0,NA,1,0,NA,NA,NA,NA,0,0,NA,NA,NA,0,5,0,0,22,"tides",15,3,0.25,NA,NA,NA
206,58415,NA,2018-12-19,"Keep By The Sea",18,12,0,NA,NA,35.1229845523,-120.63387498328,162,123,9,6,0,1,16,1,77,0,0,0,49,28,1,0,0,0,NA,0,19,15,0,12,1,0,7,2,6,2,0,1,19,0,0,0,0,NA,0,0,NA,NA,NA,NA,0,0,NA,NA,NA,1,9,0,0,19,"tides",3,15,0.25,NA,NA,NA
207,57941,NA,2018-12-25,"none",1,2.2,0,NA,NA,35.42076,-120.87817,71,68,0,0,0,3,0,0,13,3,0,0,8,47,0,0,0,0,NA,0,1,0,0,12,0,0,0,0,0,0,0,0,0,0,3,0,0,NA,0,0,NA,NA,NA,NA,0,0,NA,NA,NA,0,0,0,0,47,"tides",1,0,0,NA,NA,NA
208,57970,NA,2018-12-27,"none",1,0.31,0,NA,NA,35.42081,-120.87766,33,33,0,0,0,0,0,0,2,0,0,0,1,30,0,0,0,0,NA,0,0,0,0,2,0,0,0,0,0,0,0,0,0,0,0,0,0,NA,0,0,NA,NA,NA,NA,0,0,NA,NA,NA,0,0,0,0,30,"tides",1,0,0,NA,NA,NA
209,58304,NA,2019-01-08,"none",1,0.83,0,NA,NA,35.41815,-120.87694,84,84,0,0,0,0,0,0,1,0,0,0,2,81,0,0,0,0,NA,0,0,0,0,1,0,0,0,0,0,0,0,0,0,0,0,0,0,NA,0,0,NA,NA,NA,NA,0,0,NA,NA,NA,0,0,0,0,81,"tides",1,0,0.0505,NA,NA,NA
210,74227,NA,2019-01-08,"Keep By The Sea",42,10.1,0,NA,NA,35.123418243437,-120.63350891605,253,232,11,4,0,0,5,0,77,9,0,3,155,8,0,0,3,0,NA,0,8,0,0,2,8,3,1,7,2,12,0,1,34,0,0,0,9,NA,0,0,NA,NA,NA,NA,0,0,NA,NA,NA,0,5,0,0,3,"tides",6,36,0.25,NA,NA,NA
211,74228,NA,2019-01-09,"Keep By The Sea",21,6.12,0,NA,NA,35.123418243437,-120.63350891605,94,79,4,10,0,1,0,0,35,0,0,1,46,12,0,0,0,0,NA,0,2,0,0,12,0,4,0,2,0,3,0,0,12,0,0,0,0,NA,0,0,NA,NA,NA,NA,0,0,NA,NA,NA,0,4,0,0,8,"tides",3,18,0.25,NA,NA,NA
212,58377,NA,2019-01-10,"none",1,0.19,0,NA,NA,35.42081,-120.87763,21,21,0,0,0,0,0,0,2,0,0,0,2,17,0,0,0,0,NA,0,0,0,0,2,0,0,0,0,0,0,0,0,0,0,0,0,0,NA,0,0,NA,NA,NA,NA,0,0,NA,NA,NA,0,0,0,0,17,"tides",1,0,0.0031,NA,NA,NA
213,58919,NA,2019-01-11,"Keep By The Sea",19,3.4,0,NA,NA,35.123115277998,-120.63366370079,85,83,0,0,0,0,2,0,47,0,0,0,11,27,0,0,0,0,NA,0,2,0,0,8,5,0,0,2,2,12,0,0,16,0,0,0,0,NA,0,0,NA,NA,NA,NA,0,0,NA,NA,NA,0,0,0,0,27,"tides",16,3,0.25,NA,NA,NA
214,58961,NA,2019-01-12,"none",1,1.08,0,NA,NA,35.42359,-120.87917,58,57,0,0,0,1,0,0,3,1,0,0,3,51,0,0,0,0,NA,0,0,0,0,3,0,0,0,0,0,0,0,0,0,0,1,0,0,NA,0,0,NA,NA,NA,NA,0,0,NA,NA,NA,0,0,0,0,51,"tides",1,0,0.0851,NA,NA,NA
215,58962,NA,2019-01-12,"none",1,1.71,0,NA,NA,35.42138,-120.87871,175,175,0,0,0,0,0,0,5,0,0,0,2,168,0,0,0,0,NA,0,0,0,0,5,0,0,0,0,0,0,0,0,0,0,0,0,0,NA,0,0,NA,NA,NA,NA,0,0,NA,NA,NA,0,0,0,0,168,"tides",1,0,0.0032,NA,NA,NA
216,59237,NA,2019-01-17,"none",1,0.26,0,NA,NA,35.4184,-120.87658,31,31,0,0,0,0,0,0,7,0,0,0,2,22,0,0,0,0,NA,0,0,0,0,7,0,0,0,0,0,0,0,0,0,0,0,0,0,NA,0,0,NA,NA,NA,NA,0,0,NA,NA,NA,0,0,0,0,22,"tides",1,0,0.3937,NA,NA,NA
217,67680,NA,2019-01-17,"Keep By the Sea",24,8,0,NA,NA,35.123009682346,-120.63359402323,132,121,1,5,0,4,0,1,62,2,0,2,31,33,1,0,1,0,NA,0,9,0,0,10,1,1,1,1,2,4,0,1,33,2,0,0,0,NA,0,0,NA,NA,NA,NA,0,0,NA,NA,NA,0,1,0,0,32,"tides",5,19,0.25,NA,NA,NA
218,67681,NA,2019-01-17,"Keep By the Sea",22,8.2,0,NA,NA,35.123009682346,-120.63359402323,149,137,2,4,0,5,1,5,41,0,0,0,80,23,5,0,0,0,NA,0,1,0,0,10,0,1,0,2,4,3,0,0,20,0,0,0,0,NA,0,0,NA,NA,NA,NA,0,0,NA,NA,NA,0,2,0,0,21,"tides",3,19,0.25,NA,NA,NA
219,59238,NA,2019-01-18,"none",1,0.01,0,NA,NA,35.41307,-120.87411,2,2,0,0,0,0,0,0,2,0,0,0,0,0,0,0,0,0,NA,0,0,0,0,2,0,0,0,0,0,0,0,0,0,0,0,0,0,NA,0,0,NA,NA,NA,NA,0,0,NA,NA,NA,0,0,0,0,0,"tides",1,0,0.0418,NA,NA,NA
220,59239,NA,2019-01-18,"none",1,0.83,0,NA,NA,35.41985,-120.87734,87,87,0,0,0,0,0,0,6,0,0,0,0,81,0,0,0,0,NA,0,0,0,0,6,0,0,0,0,0,0,0,0,0,0,0,0,0,NA,0,0,NA,NA,NA,NA,0,0,NA,NA,NA,0,0,0,0,81,"tides",1,0,0.0447,NA,NA,NA
221,59240,NA,2019-01-18,"none",1,0.14,0,NA,NA,35.4204,-120.87794,7,6,0,0,0,1,0,0,0,0,0,0,1,6,0,0,0,0,NA,0,0,0,0,0,0,0,0,0,0,0,0,0,0,0,0,0,0,NA,0,0,NA,NA,NA,NA,0,0,NA,NA,NA,0,0,0,1,5,"tides",1,0,0,NA,NA,NA
222,74229,NA,2019-01-18,"Keep By The Sea",22,3.9,0,NA,NA,35.123418243437,-120.63350891605,182,167,7,6,0,1,1,0,73,1,0,5,68,35,0,0,5,0,NA,0,4,1,0,11,1,2,0,0,5,0,0,3,46,1,0,0,0,NA,0,0,NA,NA,NA,NA,0,0,NA,NA,NA,3,7,0,0,28,"tides",3,19,0.25,NA,NA,NA
223,59283,NA,2019-01-19,"none",1,0.26,0,NA,NA,35.42056,-120.87765,28,28,0,0,0,0,0,0,3,0,0,1,0,24,0,0,0,0,NA,0,0,0,0,3,0,0,0,0,0,0,0,0,0,0,0,0,0,NA,0,0,NA,NA,NA,NA,0,0,NA,NA,NA,0,0,0,0,24,"tides",1,0,0,NA,NA,NA
224,67679,NA,2019-01-23,"Keep By the Sea",43,12.5,0,NA,NA,35.123009682346,-120.63359402323,476,390,29,15,0,6,11,6,184,1,0,6,89,165,6,0,2,0,NA,0,6,7,0,43,5,4,25,6,9,12,0,4,88,0,0,0,1,NA,0,0,NA,NA,NA,NA,0,0,NA,NA,NA,1,27,0,0,138,"tides",6,37,0.25,NA,NA,NA
225,59463,NA,2019-01-24,"none",1,0.17,0,NA,NA,35.13629,-120.64052,15,9,0,4,0,0,0,0,8,0,0,0,3,2,0,0,0,0,NA,0,0,0,0,0,0,4,2,0,4,0,0,0,0,0,0,0,0,NA,0,0,NA,NA,NA,NA,0,0,NA,NA,NA,0,0,0,0,2,"tides",1,0,0,NA,NA,NA
226,67677,NA,2019-01-24,"Keep By the Sea",22,7.1,0,NA,NA,35.123009682346,-120.63359402323,109,105,0,0,0,0,0,0,33,0,0,0,22,50,0,0,0,0,NA,0,0,0,0,7,0,0,4,0,5,0,0,0,21,0,0,0,0,NA,0,0,NA,NA,NA,NA,0,0,NA,NA,NA,0,0,0,0,50,"tides",4,18,0.25,NA,NA,NA
227,67678,NA,2019-01-24,"Keep By the Sea",23,4.3,0,NA,NA,35.123009682346,-120.63359402323,150,137,3,10,0,0,0,0,52,1,0,1,54,42,0,0,1,0,NA,0,3,0,0,15,0,1,0,0,5,0,0,0,28,0,0,0,1,NA,0,0,NA,NA,NA,NA,0,0,NA,NA,NA,0,3,0,0,39,"tides",4,19,0.25,NA,NA,NA
228,67676,NA,2019-02-07,"Keep By the Sea",36,7,0,NA,NA,35.123009682346,-120.63359402323,270,228,15,7,0,8,2,8,138,1,0,10,53,50,8,0,8,0,NA,0,11,2,0,30,8,0,10,0,14,4,0,4,65,0,0,0,1,NA,0,0,NA,NA,NA,NA,0,0,NA,NA,NA,0,12,0,0,38,"tides",5,31,0.25,NA,NA,NA
229,62508,NA,2019-02-11,"Central Coast New Tech High School",2,9,0,NA,NA,35.140457397213,-120.64471059704,192,167,16,5,0,0,2,0,63,0,0,2,55,70,0,0,0,0,NA,0,3,0,0,15,5,5,2,4,1,0,0,2,28,0,0,0,0,NA,0,0,NA,NA,NA,NA,0,0,NA,NA,NA,0,11,0,2,57,"tides",2,0,2,1,NA,NA
230,65225,NA,2019-02-17,"none",1,3.96,0,NA,NA,35.41372,-120.87402,24,16,0,0,0,7,0,0,7,7,0,0,0,9,0,0,0,0,NA,0,1,0,0,4,1,0,1,0,1,0,0,0,0,0,7,0,0,NA,0,0,NA,NA,NA,NA,0,0,NA,NA,NA,0,0,0,0,9,"tides",1,0,0.1288,NA,NA,NA
231,65227,NA,2019-02-17,"none",1,0.12,0,NA,NA,35.41988,-120.8772,14,13,0,0,0,0,0,0,1,0,0,0,1,11,0,0,0,0,NA,0,0,0,0,0,0,0,1,0,1,0,0,0,0,0,0,0,0,NA,0,0,NA,NA,NA,NA,0,0,NA,NA,NA,0,0,0,0,11,"tides",1,0,0.0596,NA,NA,NA
232,65286,NA,2019-02-19,"none",1,0.91,0,NA,NA,35.42046,-120.87755,39,38,0,0,0,1,0,0,3,1,0,0,0,35,0,0,0,0,NA,0,1,0,0,2,0,0,0,0,0,0,0,0,0,0,1,0,0,NA,0,0,NA,NA,NA,NA,0,0,NA,NA,NA,0,0,0,0,35,"tides",1,0,0.0137,NA,NA,NA
233,67673,NA,2019-02-26,"Keep By the Sea",40,8,0,NA,NA,35.123009682346,-120.63359402323,217,176,0,14,0,13,12,12,68,5,0,1,93,36,12,0,1,0,NA,0,2,6,0,19,1,4,2,6,5,3,0,2,20,1,0,0,4,NA,0,0,NA,NA,NA,NA,0,1,NA,NA,NA,1,0,0,0,36,"tides",6,34,0.25,NA,NA,NA
234,67675,NA,2019-02-26,"Keep By the Sea",38,52,0,NA,NA,35.123009682346,-120.63359402323,372,323,7,28,0,4,1,4,118,0,0,0,88,153,4,0,0,0,NA,0,1,1,0,24,17,15,9,0,6,13,0,0,41,0,0,0,0,NA,0,0,NA,NA,NA,NA,0,0,NA,NA,NA,0,0,0,0,153,"tides",6,32,0.25,NA,NA,NA
235,67674,NA,2019-03-06,"Keep By the Sea",52,18,0,NA,NA,35.123009682346,-120.63359402323,234,198,6,6,0,4,11,4,124,12,0,7,36,42,4,0,7,0,NA,0,14,7,0,24,3,1,9,6,8,25,0,0,36,0,0,10,2,NA,0,0,NA,NA,NA,NA,0,0,NA,NA,NA,0,4,0,0,38,"tides",6,46,0.25,NA,NA,NA
236,67672,NA,2019-03-07,"Keep By the Sea",22,10,0,NA,NA,35.123009682346,-120.63359402323,141,129,5,7,0,0,0,0,75,0,0,1,36,29,0,0,1,0,NA,0,2,0,0,13,3,2,0,1,7,9,0,1,37,0,0,0,0,NA,0,0,NA,NA,NA,NA,0,1,NA,NA,NA,0,3,0,0,26,"tides",4,18,0.25,NA,NA,NA
237,67670,NA,2019-03-12,"Keep By the Sea",19,10,0,NA,NA,35.123009682346,-120.63359402323,97,88,4,3,0,1,1,1,27,0,0,3,37,29,1,0,3,0,NA,0,4,0,0,4,1,0,0,1,3,0,0,2,12,0,0,0,0,NA,0,0,NA,NA,NA,NA,0,0,NA,NA,NA,0,3,0,0,26,"tides",3,16,0.25,NA,NA,NA
238,67671,NA,2019-03-12,"Keep By the Sea",20,5.5,0,NA,NA,35.123009682346,-120.63359402323,133,120,0,0,0,2,6,2,43,0,0,1,59,23,2,0,1,0,NA,0,1,2,0,7,2,0,5,4,3,0,0,1,23,0,0,0,0,NA,0,0,NA,NA,NA,NA,0,0,NA,NA,NA,0,0,0,0,23,"tides",3,17,0.25,NA,NA,NA
239,67669,NA,2019-03-14,"Keep By the Sea",42,31.5,0,NA,NA,35.123009682346,-120.63359402323,273,232,10,13,0,7,7,10,146,1,0,10,60,42,7,0,10,0,NA,0,8,5,0,14,9,7,4,17,2,2,0,4,78,0,0,0,1,NA,0,0,NA,NA,NA,NA,0,0,NA,NA,NA,0,5,0,0,37,"tides",6,36,0.25,NA,NA,NA
240,73610,NA,2019-03-26,"Keep By The Sea",41,19,0,NA,NA,35.123975198016,-120.63365212773,236,203,7,7,0,0,12,0,150,0,0,0,65,14,0,0,0,0,NA,0,2,0,0,12,10,3,7,25,1,5,0,3,89,0,0,0,0,NA,0,0,NA,NA,NA,NA,0,0,NA,NA,NA,0,5,0,0,9,"tides",6,35,0.25,NA,NA,NA
241,72947,NA,2019-03-27,"Camp KEEP By The Sea",42,3.6,0,NA,NA,35.123060092696,-120.63358983943,90,79,2,7,0,0,2,0,33,1,0,0,22,34,0,0,0,0,NA,0,5,2,0,12,3,0,0,0,1,0,0,0,10,0,0,1,0,NA,0,0,NA,NA,NA,NA,0,0,NA,NA,NA,0,2,0,1,31,"tides",6,36,0.25,NA,NA,NA
242,72946,NA,2019-04-03,"Camp KEEP By The Sea",36,26,0,NA,NA,35.123060092696,-120.63358983943,160,137,10,5,0,0,4,0,65,0,0,0,81,10,0,0,0,0,NA,0,4,0,0,10,6,2,4,7,3,1,0,1,31,0,0,0,0,NA,0,0,NA,NA,NA,NA,0,0,NA,NA,NA,0,4,0,0,6,"tides",6,30,0.25,NA,NA,NA
243,103751,NA,2019-04-06,"Environmental Center of San Luis Obispo",54,61,0,NA,NA,35.365408732131,-120.85999086499,1537,1363,76,46,0,13,17,11,474,36,2,2,436,554,9,0,2,0,NA,0,51,9,0,80,24,9,22,19,51,14,0,15,205,0,0,9,27,NA,0,0,NA,NA,NA,NA,0,1,NA,NA,NA,0,63,0,36,452,"tides",51,3,2,11,NA,NA
244,69008,NA,2019-04-08,"Central Coast New Tech High School",1,2,0,NA,NA,35.140862373555,-120.64499432029,104,83,5,7,0,0,7,0,77,0,1,1,16,7,0,0,0,0,NA,5,3,0,0,21,22,1,2,14,0,2,0,2,8,0,0,0,0,NA,1,0,NA,NA,NA,NA,0,3,NA,NA,NA,0,0,0,6,0,"tides",1,0,0.5,1,NA,NA
245,73608,NA,2019-04-09,"Keep By The Sea",44,29,0,NA,NA,35.123489297629,-120.63352166121,254,245,2,5,0,0,1,0,87,0,0,0,166,0,0,0,0,0,NA,0,1,0,0,15,5,1,1,1,6,23,0,7,28,0,0,0,0,NA,0,0,NA,NA,NA,NA,0,0,NA,NA,NA,0,0,0,0,0,"tides",6,38,0.25,NA,NA,NA
246,71674,NA,2019-04-20,"Myself",1,7.1,0,NA,NA,35.13703,-120.64199,81,56,7,8,0,7,0,0,60,0,1,3,5,9,0,0,8,0,NA,0,7,0,0,3,11,8,3,3,4,5,0,13,6,0,0,0,0,NA,1,0,NA,NA,NA,NA,0,0,NA,NA,NA,0,0,0,1,3,"tides",1,0,0.0062,NA,NA,NA
247,71858,NA,2019-04-23,"Becker North",2,0.03,0,NA,NA,35.12361,-120.63286,1,1,0,0,0,0,0,0,1,0,0,0,0,0,0,0,0,0,NA,0,0,0,0,0,0,0,0,0,0,0,0,0,1,0,0,0,0,NA,0,0,NA,NA,NA,NA,0,0,NA,NA,NA,0,0,0,0,0,"tides",2,0,0.003,NA,NA,NA
248,72945,NA,2019-04-24,"Camp KEEP By The Sea",23,6,0,NA,NA,35.123060092696,-120.63358983943,194,181,3,4,0,0,2,0,79,0,0,0,107,4,0,0,0,0,NA,0,4,1,0,8,6,0,4,2,11,10,0,5,32,0,0,0,0,NA,0,0,NA,NA,NA,NA,0,0,NA,NA,NA,1,0,0,0,4,"tides",5,18,0.25,NA,NA,NA
249,73595,NA,2019-04-25,"Keep By The Sea",67,36.5,0,NA,NA,35.123708893439,-120.63339385758,426,312,79,23,0,0,9,0,224,0,0,0,68,131,0,0,0,0,NA,0,78,2,0,33,32,14,3,9,4,22,0,4,26,0,0,0,0,NA,0,0,NA,NA,NA,NA,0,0,NA,NA,NA,0,61,0,0,70,"tides",12,55,0.25,NA,NA,NA
250,103752,NA,2019-04-26,"Environmental Center of San Luis Obispo",18,196,0,NA,NA,35.120978801391,-120.63513801809,1750,1589,26,92,0,23,15,17,599,15,14,6,704,390,2,0,1,0,NA,0,26,2,0,106,36,50,5,42,32,6,0,15,287,1,0,2,12,NA,1,0,NA,NA,NA,NA,0,4,NA,NA,NA,1,23,0,15,349,"tides",18,0,3,15,NA,NA
251,73600,NA,2019-05-02,"Keep By The Sea",19,4,0,NA,NA,35.123967310295,-120.63307976261,132,109,14,5,0,0,3,0,48,0,0,1,45,37,0,0,1,0,NA,0,1,1,0,6,4,2,1,3,4,3,0,1,23,0,0,0,0,NA,0,0,NA,NA,NA,NA,0,0,NA,NA,NA,1,10,0,0,27,"tides",4,15,0.25,NA,NA,NA
252,73647,NA,2019-05-04,"Environmental Center of San Luis Obispo",26,103,0,NA,NA,35.174867335826,-120.71454803948,2118,1066,685,252,0,71,32,70,595,2,15,1,730,693,70,0,0,0,NA,20,7,26,0,253,94,63,12,10,10,0,0,17,95,0,0,2,0,NA,13,0,NA,NA,NA,NA,0,0,NA,NA,NA,0,615,0,0,78,"tides",26,0,1,103,NA,NA
253,73659,NA,2019-05-04,"Environmental Center of San Luis Obispo",26,27,0,NA,NA,35.364488864298,-120.8527718944,437,383,16,13,0,11,6,10,147,3,2,2,210,55,10,0,1,0,NA,0,4,3,0,23,17,7,8,8,9,1,0,4,71,0,0,0,3,NA,0,0,NA,NA,NA,NA,0,3,NA,NA,NA,0,8,0,13,34,"tides",24,2,1,5,NA,NA
254,73660,NA,2019-05-04,"Environmental Center of San Luis Obispo",23,54,0,NA,NA,35.120906427438,-120.62542464466,1077,943,57,51,0,10,2,6,295,24,2,2,356,378,6,0,0,0,NA,0,31,2,0,80,19,20,14,3,19,10,0,24,87,1,0,0,23,NA,1,0,NA,NA,NA,NA,0,10,NA,NA,NA,3,48,0,26,304,"tides",23,0,2,54,NA,NA
255,73661,NA,2019-05-04,"Environmental Center of San Luis Obispo",96,197,0,NA,NA,35.174397151819,-120.72483012376,3836,3397,150,108,0,64,69,57,1206,36,10,9,824,1646,54,0,2,0,NA,4,100,23,0,158,97,44,48,84,106,44,0,35,512,0,0,35,1,NA,3,0,NA,NA,NA,NA,0,12,NA,NA,NA,3,109,0,111,1425,"tides",96,0,1,100,NA,NA
256,73602,NA,2019-05-07,"Keep By The Sea",38,25,0,NA,NA,35.123756704915,-120.63350891605,167,132,6,4,0,5,17,4,103,1,0,0,38,18,4,0,0,0,NA,0,9,17,0,20,9,3,3,1,2,8,0,2,32,1,0,0,0,NA,0,0,NA,NA,NA,NA,0,0,NA,NA,NA,0,4,0,0,14,"tides",5,33,0.25,NA,NA,NA
257,73604,NA,2019-05-08,"Keep By The Sea",20,11.1,0,NA,NA,35.123679179957,-120.63336089083,105,93,6,6,0,0,0,0,67,0,0,1,17,20,0,0,1,0,NA,0,3,0,0,12,3,4,0,0,2,6,0,8,29,0,0,0,0,NA,0,0,NA,NA,NA,NA,0,0,NA,NA,NA,0,6,0,0,14,"tides",3,17,0.25,NA,NA,NA
258,73638,NA,2019-05-08,"Environmental Center of San Luis Obispo",27,12,0,NA,NA,35.176501249158,-120.73116075859,738,691,22,11,0,7,1,3,224,4,0,1,109,391,3,0,0,0,NA,0,10,0,0,45,9,3,6,6,20,7,0,8,116,3,0,1,0,NA,0,0,NA,NA,NA,NA,0,3,NA,NA,NA,1,14,0,29,348,"tides",27,0,1,3,NA,NA
259,73605,NA,2019-05-09,"Keep By The Sea",22,6.26,0,NA,NA,35.123756704915,-120.63342308536,184,163,9,9,0,0,1,0,101,0,0,0,36,45,0,0,0,0,NA,0,1,0,0,11,9,2,2,1,1,5,0,1,70,0,0,0,0,NA,0,0,NA,NA,NA,NA,0,0,NA,NA,NA,0,3,0,0,42,"tides",5,17,0.25,NA,NA,NA
260,74172,NA,2019-05-09,"Keep By The Sea",18,3,0,NA,NA,35.123490194277,-120.63347228462,55,51,1,3,0,0,0,0,8,0,0,0,29,18,0,0,0,0,NA,0,0,0,0,0,0,3,0,0,3,0,0,0,2,0,0,0,0,NA,0,0,NA,NA,NA,NA,0,0,NA,NA,NA,0,1,0,0,17,"tides",3,15,0.25,NA,NA,NA
261,73172,NA,2019-05-13,"The nature Conservancy dangermond preserve",8,25.88,0,NA,NA,34.46003,-120.47312,216,162,0,0,0,45,0,0,61,18,3,22,0,103,0,0,42,0,NA,0,5,0,0,5,27,0,9,2,4,12,0,1,5,0,18,0,0,NA,3,0,NA,NA,NA,NA,0,0,NA,NA,NA,0,0,0,2,79,"tides",8,0,0.7394,NA,NA,NA
262,73174,NA,2019-05-13,"The Nature Conservancy Dangermond Preserve",8,11.51,0,NA,NA,34.45317,-120.46595,158,128,0,0,0,29,0,0,27,4,4,11,0,111,0,0,28,0,NA,0,0,0,0,4,14,0,1,1,5,1,0,0,2,0,4,0,0,NA,4,0,NA,NA,NA,NA,0,0,NA,NA,NA,0,0,0,3,90,"tides",8,0,1.8788,NA,NA,NA
263,73359,NA,2019-05-13,"The Nature Conservancy Dangermond Preserve",4,26.58,0,NA,NA,34.45305,-120.4183,412,342,2,2,0,61,0,0,81,13,8,17,0,288,0,0,43,0,NA,0,5,0,0,4,46,2,5,6,7,5,0,2,4,0,13,0,0,NA,8,0,NA,NA,NA,NA,0,0,NA,NA,NA,0,0,0,14,248,"tides",4,0,1.8452,NA,NA,NA
264,73201,NA,2019-05-14,"The Nature Conservancy Dangermond Preserve",1,0.22,0,NA,NA,34.44637,-120.45278,4,3,0,0,0,1,0,0,3,0,0,0,0,1,0,0,1,0,NA,0,0,0,0,0,2,0,0,0,1,0,0,0,0,0,0,0,0,NA,0,0,NA,NA,NA,NA,0,0,NA,NA,NA,0,0,0,0,0,"tides",1,0,0.0065,NA,NA,NA
265,73606,NA,2019-05-15,"Keep By The Sea",42,21,0,NA,NA,35.123780782991,-120.63350891605,338,296,26,12,0,0,1,0,131,0,0,0,81,123,0,0,0,0,NA,0,19,0,0,9,7,8,3,3,0,1,0,0,84,0,0,0,0,NA,0,0,NA,NA,NA,NA,0,0,NA,NA,NA,1,24,0,0,99,"tides",8,34,0.25,NA,NA,NA
266,73607,NA,2019-05-22,"Keep By The Sea",21,6,0,NA,NA,35.123897108562,-120.63350891605,163,108,24,11,0,1,18,0,89,1,0,2,22,48,0,0,2,0,NA,0,7,1,0,20,4,1,1,19,6,17,0,5,9,1,0,0,0,NA,0,0,NA,NA,NA,NA,0,0,NA,NA,NA,1,23,0,0,25,"tides",4,17,0.25,NA,NA,NA
267,73588,NA,2019-05-23,"Keep By The Sea",42,1.41,0,NA,NA,35.123424860264,-120.63346038015,57,46,2,7,0,0,2,0,32,0,0,0,22,3,0,0,0,0,NA,0,5,2,0,12,3,0,0,0,0,0,0,0,10,0,0,0,0,NA,0,0,NA,NA,NA,NA,0,0,NA,NA,NA,0,2,0,0,1,"tides",6,36,0.25,NA,NA,NA
268,73589,NA,2019-05-23,"Keep By The Sea",36,13.3,0,NA,NA,35.123897108562,-120.63359474674,160,138,9,5,0,0,4,0,66,0,0,0,81,9,0,0,0,0,NA,0,4,0,0,10,6,2,4,8,3,1,0,1,31,0,0,0,0,NA,0,0,NA,NA,NA,NA,0,0,NA,NA,NA,0,3,0,0,6,"tides",6,30,0.25,NA,NA,NA
269,73590,NA,2019-05-23,"Keep By The Sea",23,6,0,NA,NA,35.123651402021,-120.63346600071,201,185,3,4,0,3,2,0,82,1,3,0,107,4,0,0,0,0,NA,0,8,1,0,8,6,0,4,1,11,10,0,5,32,0,0,1,0,NA,0,0,NA,NA,NA,NA,0,0,NA,NA,NA,1,0,0,0,4,"tides",5,18,0.25,NA,NA,NA
270,102885,NA,2019-05-28,"Environmental Center of San Luis Obispo",15,150,0,NA,NA,35.176162899822,-120.71645085126,1679,1044,393,222,0,2,7,2,606,0,23,3,452,582,0,0,0,0,NA,0,25,0,0,214,174,38,11,19,8,9,0,10,111,0,0,0,0,NA,20,0,NA,NA,NA,NA,0,0,NA,NA,NA,1,257,0,4,319,"tides",15,0,1,12,NA,NA
271,74171,NA,2019-05-29,"Keep By The Sea",60,15,0,NA,NA,35.123490194277,-120.63347228462,287,232,43,1,0,6,4,6,102,0,0,0,84,94,6,0,0,0,NA,0,23,0,0,12,5,0,1,13,4,2,0,3,40,0,0,0,0,NA,0,0,NA,NA,NA,NA,0,0,NA,NA,NA,0,42,0,0,52,"tides",9,51,0.25,NA,NA,NA
272,74214,NA,2019-06-07,"Keep By The Sea",1,7,0,NA,NA,35.123418243437,-120.63350891605,219,204,1,6,0,5,1,6,58,0,0,10,71,72,5,0,10,0,NA,0,8,0,0,10,2,2,2,3,2,10,0,4,17,0,0,0,0,NA,0,0,NA,NA,NA,NA,0,0,NA,NA,NA,0,0,0,0,72,"tides",1,0,0.25,NA,NA,NA
273,103756,NA,2019-06-15,"Environmental Center of San Luis Obispo",9,19,0,NA,NA,35.370538434174,-120.86531236768,568,504,11,29,0,10,6,0,182,1,5,5,283,84,0,0,0,0,NA,1,15,2,0,36,15,12,8,13,12,3,0,2,71,0,0,1,0,NA,0,0,NA,NA,NA,NA,0,0,NA,NA,NA,0,6,0,12,66,"tides",8,1,1,5,NA,NA
274,75065,NA,2019-06-25,"none",1,1.22,0,NA,NA,35.08343,-120.62958,6,2,1,0,0,2,0,0,3,1,0,0,0,1,0,0,1,0,NA,0,1,0,0,0,1,0,1,0,0,0,0,0,1,0,1,0,0,NA,0,0,NA,NA,NA,NA,0,0,NA,NA,NA,0,0,0,0,0,"tides",1,0,0.0031,NA,NA,NA
275,76258,NA,2019-07-20,"Environmental Center of San Luis Obispo",12,30,0,NA,NA,35.178289689346,-120.7333907296,777,733,0,31,0,1,1,0,160,1,1,0,556,48,0,0,0,0,NA,0,6,0,0,59,0,4,11,8,14,1,0,10,58,0,0,0,1,NA,0,0,NA,NA,NA,NA,0,0,NA,NA,NA,0,0,0,35,13,"tides",7,5,0.25,4,NA,NA
276,95843,NA,2019-08-27,"Keep By The Sea",14,4,0,NA,NA,35.124079968925,-120.63335316951,222,204,0,4,0,4,3,4,81,0,0,24,86,20,4,0,24,0,NA,0,12,0,0,7,3,4,7,5,16,0,0,4,30,0,0,0,0,NA,0,0,NA,NA,NA,NA,0,0,NA,NA,NA,0,0,0,0,20,"tides",2,12,0.25,NA,NA,NA
277,95847,NA,2019-08-28,"Keep By The Sea",14,7.09,0,NA,NA,35.124079968925,-120.63335316951,302,291,4,6,0,0,1,0,56,0,0,2,168,76,0,0,2,0,NA,0,10,0,0,15,7,2,0,6,2,6,0,3,5,0,0,0,0,NA,0,0,NA,NA,NA,NA,0,0,NA,NA,NA,0,0,0,0,76,"tides",2,12,0.25,NA,NA,NA
278,95849,NA,2019-08-29,"Keep By The Sea",15,23.15,0,NA,NA,35.124079968925,-120.63335316951,193,161,15,4,0,0,1,0,60,1,0,0,94,26,0,0,0,0,NA,0,6,0,0,13,22,1,12,1,0,0,0,2,15,0,0,0,1,NA,0,0,NA,NA,NA,NA,0,0,NA,NA,NA,1,4,0,0,22,"tides",3,12,0.25,NA,NA,NA
279,95857,NA,2019-09-03,"Keep By The Sea",7,1,0,NA,NA,35.124079968925,-120.63335316951,96,92,1,2,0,0,1,0,32,0,0,1,48,15,0,0,1,0,NA,0,0,0,0,4,0,0,0,1,1,0,0,0,26,0,0,0,0,NA,0,0,NA,NA,NA,NA,0,0,NA,NA,NA,0,1,0,0,14,"tides",1,6,0.25,NA,NA,NA
280,95854,NA,2019-09-04,"Keep By The Sea",18,10.2,0,NA,NA,35.124079968925,-120.63335316951,189,175,2,7,0,0,2,0,66,0,0,0,97,23,0,0,0,0,NA,0,3,2,0,14,3,4,3,2,5,0,0,0,33,0,0,0,0,NA,0,0,NA,NA,NA,NA,0,0,NA,NA,NA,0,2,0,0,21,"tides",3,15,0.25,NA,NA,NA
281,95856,NA,2019-09-05,"Keep By The Sea",17,5.7,0,NA,NA,35.124079968925,-120.63335316951,272,245,0,24,0,2,1,3,143,0,0,2,42,82,2,0,1,0,NA,0,7,0,0,13,32,20,0,3,3,7,0,1,57,0,0,0,0,NA,0,0,NA,NA,NA,NA,0,0,NA,NA,NA,0,0,0,0,82,"tides",3,14,0.25,NA,NA,NA
282,95859,NA,2019-09-11,"Keep By The Sea",39,5.31,0,NA,NA,35.124079968925,-120.63335316951,344,321,8,9,0,1,2,2,96,0,0,7,175,61,1,0,6,0,NA,0,14,1,0,31,3,0,3,2,5,0,0,4,36,0,0,0,0,NA,0,0,NA,NA,NA,NA,0,1,NA,NA,NA,0,7,0,0,54,"tides",6,33,0.25,NA,NA,NA
283,95860,NA,2019-09-12,"Keep By The Sea",39,5.4,0,NA,NA,35.124079968925,-120.63335316951,662,615,4,23,0,11,6,11,279,3,0,6,250,110,11,0,5,0,NA,0,21,4,0,46,4,7,3,5,7,17,0,8,160,0,0,1,2,NA,0,0,NA,NA,NA,NA,0,0,NA,NA,NA,0,4,0,0,106,"tides",6,33,0.25,NA,NA,NA
284,102891,NA,2019-09-13,"Environmental Center of San Luis Obispo",13,35,0,NA,NA,35.179376215141,-120.73552431996,531,479,3,36,0,2,8,2,217,15,0,0,230,64,2,0,0,0,NA,0,8,4,0,74,13,10,3,10,10,2,0,5,81,0,0,15,0,NA,0,0,NA,NA,NA,NA,0,2,NA,NA,NA,1,1,0,7,56,"tides",13,0,2,7,NA,NA
285,95862,NA,2019-09-17,"Keep By The Sea",41,10.95,0,NA,NA,35.124079968925,-120.63335316951,316,280,11,13,0,1,3,1,100,0,0,0,184,23,1,0,0,0,NA,0,6,3,0,20,13,4,8,1,6,1,0,2,44,0,0,0,0,NA,0,0,NA,NA,NA,NA,0,0,NA,NA,NA,0,4,0,0,19,"tides",6,35,0.25,NA,NA,NA
286,95863,NA,2019-09-18,"Keep By The Sea",40,8.1,0,NA,NA,35.124079968925,-120.63335316951,335,297,18,8,0,0,3,1,112,0,0,7,148,58,0,0,5,0,NA,0,19,2,0,27,19,2,9,7,3,2,0,3,28,0,0,0,0,NA,0,0,NA,NA,NA,NA,0,0,NA,NA,NA,1,12,0,0,46,"tides",7,33,0.25,NA,NA,NA
287,80900,NA,2019-09-21,"Paradise dive club",1,3,0,NA,NA,34.46329,-120.09912,208,176,0,0,0,21,0,0,13,0,1,2,4,177,0,0,12,0,NA,0,2,0,0,4,2,0,11,0,4,0,0,1,0,0,0,0,0,NA,1,0,NA,NA,NA,NA,0,0,NA,NA,NA,0,0,0,10,157,"tides",1,0,0,NA,NA,NA
288,81119,NA,2019-09-21,"Dragonfruit",7,6.85,0,NA,NA,34.47163,-120.22811,121,87,4,3,0,22,0,0,49,2,4,1,15,45,0,0,9,0,NA,0,1,0,0,11,7,3,5,2,6,6,0,3,10,0,2,0,0,NA,4,0,NA,NA,NA,NA,0,0,NA,NA,NA,0,0,0,8,29,"tides",7,0,1.1873,NA,NA,NA
289,81216,NA,2019-09-21,"none",3,4.69,0,NA,NA,34.48287,-120.22929,150,117,1,1,0,23,0,0,23,0,2,1,8,108,0,0,14,0,NA,0,0,0,0,9,1,1,8,2,3,3,0,0,4,0,0,0,0,NA,2,0,NA,NA,NA,NA,0,0,NA,NA,NA,0,0,0,8,87,"tides",3,0,2.5993,NA,NA,NA
290,81481,NA,2019-09-21,"Explore ecology",1,13,0,NA,NA,34.45955,-120.02604,113,60,12,13,0,26,0,0,43,2,2,1,8,55,0,0,8,0,NA,0,4,0,0,4,18,13,2,1,1,2,0,0,0,0,2,0,0,NA,2,0,NA,NA,NA,NA,0,0,NA,NA,NA,0,0,0,14,33,"tides",1,0,0.0157,NA,NA,NA
291,82043,NA,2019-09-21,"none",3,4.93,0,NA,NA,34.47165,-120.22811,98,71,1,0,0,26,0,0,28,1,0,1,16,52,0,0,23,0,NA,0,1,0,0,5,1,0,0,0,3,1,0,1,16,0,1,0,0,NA,0,0,NA,NA,NA,NA,0,0,NA,NA,NA,0,0,0,2,27,"tides",3,0,0.7232,NA,NA,NA
292,95077,NA,2019-09-21,"Explore Ecology- Gaviota State Beach",51,68,0,NA,NA,34.470850144054,-120.22812996413,1368,1200,58,39,0,15,34,8,604,26,2,5,167,534,3,0,1,0,NA,50,55,11,0,110,71,12,22,41,48,34,0,5,168,10,0,11,5,NA,0,0,NA,NA,NA,NA,0,3,NA,NA,NA,2,32,0,67,434,"tides",51,0,2,NA,NA,NA
293,95173,NA,2019-09-21,"Explore Ecology-Hollister Ranch",17,81.5,0,NA,NA,34.467921530829,-120.25843467375,161,135,20,1,0,5,0,0,6,55,0,0,0,100,0,0,0,0,NA,0,0,0,0,0,0,1,0,0,0,0,0,5,0,5,0,5,45,NA,0,0,NA,NA,NA,NA,0,0,NA,NA,NA,0,20,0,0,80,"tides",17,0,7,2,NA,NA
294,95179,NA,2019-09-21,"Explore Ecology- Refugio State Beach",16,41.5,0,NA,NA,34.460693474932,-120.07958874141,428,371,2,17,0,18,5,11,225,9,3,2,24,139,11,0,0,0,NA,0,16,2,0,35,4,3,15,5,6,15,0,65,74,4,0,3,2,NA,0,0,NA,NA,NA,NA,0,4,NA,NA,NA,1,1,0,23,115,"tides",16,0,2,1,NA,NA
295,95702,NA,2019-09-21,"Explore Ecology- Jalama Beach",27,31,0,NA,NA,34.510055460737,-120.50173502487,616,481,28,47,0,18,30,17,290,18,1,5,60,213,17,0,0,0,NA,0,42,29,0,57,20,13,12,5,14,5,0,7,101,0,0,8,10,NA,0,0,NA,NA,NA,NA,0,2,NA,NA,NA,1,23,0,15,172,"tides",27,0,2,NA,NA,NA
296,95707,NA,2019-09-21,"Explore Ecology- Tajiguas Beach",13,135,0,NA,NA,34.464013160889,-120.10143579589,305,200,48,26,0,8,9,0,236,3,7,1,41,3,0,0,0,0,NA,0,9,2,0,26,105,17,14,8,14,20,0,1,34,1,0,0,2,NA,0,0,NA,NA,NA,NA,0,0,NA,NA,NA,0,0,0,3,0,"tides",13,0,0.5,4,NA,NA
297,95171,NA,2019-09-21,"Explore Ecology-Guadalupe Dunes",55,213,0,NA,NA,35.005602314115,-120.63854367894,1075,432,523,52,0,43,21,36,223,55,0,3,26,728,34,0,1,0,NA,1,8,1,0,79,26,18,4,51,10,6,0,5,19,7,0,14,34,NA,0,0,NA,NA,NA,NA,0,3,NA,NA,NA,7,515,0,32,180,"tides",55,0,17.5,4,NA,NA
298,100501,NA,2019-09-21,"Environmental Center of San Luis Obispo",36,22.5,0,NA,NA,35.448943493073,-120.90583259312,728,626,28,37,0,18,16,18,378,15,5,8,210,91,17,0,0,0,NA,0,19,8,0,72,51,6,3,35,12,0,0,78,97,0,0,11,4,NA,5,0,NA,NA,NA,NA,0,0,NA,NA,NA,0,17,0,0,74,"tides",20,16,1,3,NA,NA
299,100502,NA,2019-09-21,"Environmental Center of San Luis Obispo",1,5,0,NA,NA,35.435184624052,-120.88809571905,680,624,5,11,0,3,4,2,310,4,0,0,174,157,2,0,0,0,NA,0,32,0,0,93,25,2,33,13,7,32,0,11,95,1,0,0,3,NA,0,0,NA,NA,NA,NA,0,0,NA,NA,NA,0,3,0,14,140,"tides",1,0,1,NA,NA,NA
300,100504,NA,2019-09-21,"Environmental Center of San Luis Obispo",22,31.5,0,NA,NA,35.405498488392,-120.86980276616,494,429,12,25,0,3,20,1,183,11,1,0,83,210,1,0,0,0,NA,0,9,17,0,74,5,3,5,14,14,7,0,0,41,2,0,1,8,NA,1,0,NA,NA,NA,NA,0,0,NA,NA,NA,1,11,0,11,187,"tides",14,8,1,NA,NA,NA
301,100505,NA,2019-09-21,"Environmental Center of San Luis Obispo",67,877,0,NA,NA,35.378059334743,-120.85665675449,1310,1113,94,52,0,18,25,13,488,14,5,2,373,407,13,0,0,0,NA,0,45,5,0,72,82,29,8,25,26,27,0,24,154,0,0,3,11,NA,2,0,NA,NA,NA,NA,0,13,NA,NA,NA,2,84,0,36,286,"tides",57,10,1,6,NA,NA
302,100506,NA,2019-09-21,"Environmental Center of San Luis Obispo",30,39,0,NA,NA,35.374942984055,-120.86331633174,1002,840,87,39,0,11,11,7,324,7,6,3,285,356,4,0,0,0,NA,0,18,4,0,83,25,4,14,19,15,3,0,0,153,0,0,1,6,NA,0,0,NA,NA,NA,NA,0,2,NA,NA,NA,1,73,0,34,249,"tides",30,0,0.5,4,NA,NA
303,100507,NA,2019-09-21,"Environmental Center of San Luis Obispo",57,70,0,NA,NA,35.368348465825,-120.86656410105,2342,2102,73,76,0,34,34,18,854,115,11,3,854,464,17,0,3,0,NA,6,29,10,0,121,36,26,23,55,37,31,0,14,491,12,0,97,6,NA,6,0,NA,NA,NA,NA,0,7,NA,NA,NA,3,54,0,85,323,"tides",50,7,1,7,NA,NA
